Security Deposit Loan, Loan,,,,,,,,
How to downsize in family vehicles in this economy, Banking,,,,,,,,
Being taken to court over a debt 2yrs old, Advisory Services,,,,,,,,
FOUR Levels to Financial Freedom, Advisory Services,,,,,,,,
Question about a car loan, Loan,,,,,,,,
Taking several large loans., Loan,,,,,,,,
Advice..., Advisory Services,,,,,,,,
Establishing my new Budget, Banking,,,,,,,,
Debt Management Advice, Advisory Services,,,,,,,,
Assistance needed on my debt situation, Advisory Services,,,,,,,,
Anyone Plz... Help.... advice., Advisory Services,,,,,,,,
in need of a loan, Loan,,,,,,,,
paying loans off., Loan,,,,,,,,
Chasing my tail!, Banking,,,,,,,,
Huge student loan payments ... Am I looking at it the right way?, Loan,,,,,,,,
I didn't buy anything -but they want money! , Advisory Services,,,,,,,,
Student Loan Consolidation, Loan,,,,,,,,
Wanted Privately Invested Personal secured or unsecured loan!, Loan,,,,,,,,
Need a loan for vacation leaving in 6 hours., Loan,,,,,,,,
Bankruptcy v.s. ConsumerCreditCounselor, Banking,,,,,,,,
How quickly things fell apart!!!!, Banking,,,,,,,,
Effects of debt, Advisory Services,,,,,,,,
I need someone to lend a quick $60-$100 so bad!, Loan,,,,,,,,
Settling Debt with BOA, Advisory Services,,,,,,,,
Need Help, Banking,,,,,,,,
Cosigned daughters student loan, now shes not paying and I can't afford!!  HELP!! , Loan,,,,,,,
Received a summons. Advice?, Advisory Services,,,,,,,,
NPV analysis under uncertainty, Banking,,,,,,,,
What is considered a Good Credit Score in 2010?, Banking,,,,,,,,
Breakeven, Banking,,,,,,,,
The Many Benefits of Hiring Virtual Assistants, Insurance,,,,,,,,
business finance question, Loan,,,,,,,,
Philadelphia Tax Amnesty - Time's Almost Up! , Banking,,,,,,,,
selling a chapter 11 bankrupt judgment, Banking,,,,,,,,
How do i go about financing a business network?, Banking,,,,,,,,
Help on finding funds to finish a BG and loan, Banking,,,,,,,,
Is there an SBA program for this?, Banking,,,,,,,,
Hi All, Banking,,,,,,,,
12 month rolling, Banking,,,,,,,,
New to business. Need assistance on personal tax., Loan,,,,,,,,
Operating Cycle Turnover vs. Current Ratio, Banking,,,,,,,,
greeting, Banking,,,,,,,,
Hello!, Banking,,,,,,,,
Introducing Myself, Advisory Services,,,,,,,,
Hello from Sunny Florida!, Banking,,,,,,,,
Contract agreement question, Banking,,,,,,,,
NPV and Reducing Flot, Banking,,,,,,,,
Cash collection, Banking,,,,,,,,
Hello All, Banking,,,,,,,,
Hello, Banking,,,,,,,,
Hi my name is miles and i need help getting a personal loan, Loan,,,,,,,,
Sep Ira, Banking,,,,,,,,
Market value vs. book value (preferred shares), Real Estate,,,,,,,,
EDCGold Accounts, Banking,,,,,,,,
Howdy-Sauce, Banking,,,,,,,,
Finance involves in individuals,Business entities and other organization, Loan,,,,,,,
A Quick Introduction, Banking,,,,,,,,
Is there any hope ?, Banking,,,,,,,,
Greetings from AZ, Banking,,,,,,,,
I'm new here , Banking,,,,,,,,
Good Afternoon!, Banking,,,,,,,,
Hello from Colorado, Banking,,,,,,,,
About Myself, Banking,,,,,,,,
Hi there!, Banking,,,,,,,,
Recent College Grad - Up to my ears in college debt, Advisory Services,,,,,,,,
Welcome to my nightmare., Advisory Services,,,,,,,,
Hello all, Banking,,,,,,,,
What's the best way of doing decorative room and also to keep it clean? , Advisory Services,,,,,,,,
I need to buy a step ladder but a sturdy one. Where can I get it from?, Banking,,,,,,,,
The cabinets in my kitchen are too high. What can I use to reach them?, Banking,,,,,,,,
I want to buy my son a bag for his trekking class. Where can I get good ones?, Banking,,,,,,,,
I want to buy a bag for my holiday but do not want to spend a lot on it. Recomand, Banking,,,,,,,,
Where can I get venetian blinds for my bedroom as it gets direct sunlight?, Banking,,,,,,,,
I want to get some good looking chandelier in my living room. Give some ideas., Banking,,,,,,,,
I have heard that IKEA has step ladders. How is the quality as I'm planning to buy? , Banking,,,,,,,,
My sitting area looks a little drab as there is no direct sunlight. How can I doll it, Banking,,,,,,,,
What is the best way to get to reach the far ends of her kitchen cabinets corners?, Advisory Services,,,,,,,,
I am new in Qatar and want to get furniture for my house. Where can I get good stuff?, Banking,,,,,,,,
My child is small. What should I get to make her comfortable?, Banking,,,,,,,,
I am going for my boss' house warming tomorrow. What can I get him? , Banking,,,,,,,,
I have a lot of guests coming in and need to buy good quality towels for them., Banking,,,,,,,,
I want to gift my parents something on their anniversary. Please recommend., Banking,,,,,,,,
Is it safe to buy furniture online?, Banking,,,,,,,,
I want a smart looking alarm clock. Where can I get it from?, Banking,,,,,,,,
I want to buy a floor lamp for my sitting area. Please suggest., Banking,,,,,,,,
I get a stiff neck easily & need to get a good pillow for myself. Where can I get?, Banking,,,,,,,,
I want to do up my baby's room with colour stickers. Please suggest. , Banking,,,,,,,,
If I open a children's savings account, what kind of benefits will I get? , Banking,,,,,,,
Planning to change my phone number. Will I also have to change it for my mobile bank, Banking,,,,,,,,
I am planning to get a cashback card. Will it give me a discount on telecom?, Banking,,,,,,,,
I want to take a loan to buy machinery for my business. Will I get a loan from a bank, Loan,,,,,,,,
Through Smartbusiness what kind of remittances can one make?, Banking,,,,,,,,
If I have a payroll account, can I get online banking option?, Banking,,,,,,,
I want to take a personal loan. What is the maximum I can take?, Loan,,,,,,,,
Will I be able to pay my electricity bill through mobile banking?, Banking,,,,,,,,
I want to take a loan against shares. What is the eligibility criteria for it?, Loan,,,,,,,,
Need help learning about small auto loans with no credit., Loan,,,,,,,,
what is the basic aim of banks providing long term finance options?, Loan,,,,,,,,
what are the features of Emirates Islamic bank's commercial property finance ? , Banking,,,,,,,,
Do all banks offer a variety of easy home loan options in uae?, Loan,,,,,,,,
Is there any credit card that is compliant with shari'a? , Credit Card,,,,,,,,
What are the key features of structure solutions as part of the contract finance., Advisory Services,,,,,,,,
Does any bank offer commercial loan which is shari'a compliant? , Loan,,,,,,,,
Investing for the future, Investment,,,,,,,,
What are the various projects for which Emirates islamic bank offers commercial finan, Banking,,,,,,,,
Does any Islamic bank provide commercial loans which are in compliance with shari'a? , Banking,,,,,,,,
What are the arrangements of financial accomodation made by emirates islamic bank?, Banking,,,,,,,,
Advfn.com, Loan,,,,,,,,
precious metals, Banking,,,,,,,,
79 Buffett Quotes On Investing, Real Estate,,,,,,,,
What are the benefits of owning a Dubai Islamic bank credit card?, Banking,,,,,,,,
American living abroad foreign exchange, Banking,,,,,,,,
Bull Market Definiton, Real Estate,,,,,,,,
Bear Market Definition, Real Estate,,,,,,,,
Berkshire Hathaway Stock Holdings, Advisory Services,,,,,,,,
Rule # 1 Never Lose Money, Advisory Services,,,,,,,,
Rule #2 Never Forget Rule #1, Banking,,,,,,,,
Warren Buffett and a durable competitive advantage, Banking,,,,,,,,
Shorting the stock market, Advisory Services,,,,,,,,
Best Investment plan for business, Banking,,,,,,,,
Stock Picking Companies, Advisory Services,,,,,,,,
Basics for investing in Stockmarket, Real Estate,,,,,,,,
Torn about retirement, Retirement Plan,,,,,,,,
Plz give some helpful advice., Advisory Services,,,,,,,,
401k vs Home Ownership, What Are Your Thoughts?, Loan,,,,,,,
Need advice from investors., Advisory Services,,,,,,,,
Binary Option Trading, Banking,,,,,,,,
stratagy to pay off car loan., Loan,,,,,,,,
Help me make sense of this student loan, Loan,,,,,,,,
Trying to live the American dream., Banking,,,,,,,,
Is this a good idea?, Banking,,,,,,,,
Personal and Business Loans !!! Your Turning Point!!!, Loan,,,,,,,,
I want out of my car loan please help...., Loan,,,,,,,,
When A New Car Saves Money??, Advisory Services,,,,,,,,
Dumbest thing you ever took out a loan for., Loan,,,,,,,,
buying an older car 1993, Loan,,,,,,,,
Bad credit and Personal Loan - On the payroll, Loan,,,,,,,,
Car financing question!, Loan,,,,,,,,
Looking For A $25,000 Loan, Loan,,,,,,,
Student Loans for a car?, Loan,,,,,,,,
Student loan question, Loan,,,,,,,,
Lender forced me to meet criteria for approval, Banking,,,,,,,,
Interest amount varies greatly from month to month, Banking,,,,,,,,
Loan & Credit repair placement services, Loan,,,,,,,,
Online loans, Loan,,,,,,,,
Short Term Loan Experiences, Loan,,,,,,,,
Personal Loan, Loan,,,,,,,,
When you owe a PERSON money, Advisory Services,,,,,,,,
Sell car to pay debt?, Advisory Services,,,,,,,,
would getting a credit card help my debt!!!, Advisory Services,,,,,,,,
Paying Off Debt, Advisory Services,,,,,,,,
Bankruptcy or Settlement Payments??, Banking,,,,,,,,
Credit Card Debt Settlement Advice, Advisory Services,,,,,,,,
Your Quick Guide For Credit Cards, Credit Card,,,,,,,,
401K withdrawl to pay off debt?, Advisory Services,,,,,,,,
Are you UNNATURALLY attached to your credit cards?, Credit Card,,,,,,,,
How Do I Start Financial Freedom Journey?, Loan,,,,,,,,
I need some guidance, please help., Banking,,,,,,,
What is your Debt Elimination Strategy?, Advisory Services,,,,,,,,
check out these articles, Banking,,,,,,,,
CC debt from LLC that is dissolved, Advisory Services,,,,,,,,
Credit card debt, Banking,,,,,,,,
What should I do?, Banking,,,,,,,,
Need help planning debt repayment, Advisory Services,,,,,,,,
Five Important Customer Service Habits, Banking,,,,,,,,
Which way is the right way?, Advisory Services,,,,,,,,
Debt Collection over seas., Advisory Services,,,,,,,,
Here is My situation, desperate for advice!, Advisory Services,,,,,,,
Is insurance a relatively safe business?, Insurance,,,,,,,,
Market Value of Debt, Advisory Services,,,,,,,,
How to value a company with negative equity?, Loan,,,,,,,,
Need help with stocks, taxes, and my LLC, Banking,,,,,,
What strong financial institutions have in common: the Windward Rule, Advisory Services,,,,,,,,
How do I modify the Break-Even Formula to fit my needs?, Banking,,,,,,,,
Cash Flowing Business On Credit Card, Banking,,,,,,,,
Hi to Everybody..............., Banking,,,,,,,,
determining beta values for private companies, Banking,,,,,,,,
What does the value of a stock matter?, Advisory Services,,,,,,,,
How do we fix this?, Banking,,,,,,,,
Presenting Myself before, Banking,,,,,,,,
Hello Members, Banking,,,,,,,,
Hi everyone!, Banking,,,,,,,,
Need 1099 tax/finance Help, Advisory Services,,,,,,,,
Software for accounts?, Banking,,,,,,,,
How to put loan commission fees into perspective?, Loan,,,,,,,,
Hello, Banking,,,,,,,,
Good day, Banking,,,,,,,,
Please read about my daughter, Banking,,,,,,,,
How to transfer consulting income to newly formed LLC?, Banking,,,,,,,,
Idea Help for my Company Contest, Loan,,,,,,,,
Collections, Banking,,,,,,,,
hello, Banking,,,,,,,,
55+; just starting good financial habits., Advisory Services,,,,,,,,
hi, Banking,,,,,,,,
Fas 157-3, Banking,,,,,,,,
Fixed payments, Banking,,,,,,,,
Business  loan without personal guarantee?, Loan,,,,,,,,
I want to keep a wall shelf under my television that is wall mounted. What kind shoul, Banking,,,,,,,,
Hi everyone :), Banking,,,,,,,,
Hello let me introduce myself, Banking,,,,,,,,
Hi All, Banking,,,,,,,,
Hello from the Stock Trader, Advisory Services,,,,,,,,
I want to have some good lighting for my sit out. Please suggest., Banking,,,,,,,,
I want to get a hat rack for the house. Where can I get a good one?, Banking,,,,,,,,
Planning to change the light fixtures in the house. What are your suggestions?, Banking,,,,,,,,
Introduction, Banking,,,,,,,,
Hello Everyone!!, Banking,,,,,,,,
Securing The Future, Advisory Services,,,,,,,,
Which industry sector companies are focussing most in Saudi?, Banking,,,,,,,,
There are many companies who set up business in Saudi. Do all succeed the competition, Loan,,,,,,,,
Are there enough energy projects in Saudi?, Banking,,,,,,,,
Hello from the insurance man, Insurance,,,,,,,,
Blake, rocking this house!, Banking,,,,,,,
Hello all, Banking,,,,,,,,
How popular are solar installations in middle east?, Banking,,,,,,,,
Can I get earth movers in Saudi for purchase or lease?, Banking,,,,,,,,
"Buy ID Card,Driving License,Passport(originaldocumentation@outlook.com )", Advisory Services,,,,,,,,
I want a good study light for my child's desk. Pleas suggest. , Banking,,,,,,,,
I want to get good beauty products as my skin is very sensitive. Please recommend., Banking,,,,,,,,
My bathroom is very dingy. What can I do to make it brighter?, Banking,,,,,,,,
Is it tough to get rid of cockroaches once they venture into your house?, Banking,,,,,,,,
Can you give me some tips to control bed bugs?, Banking,,,,,,,,
What is a Brazilian wax?, Banking,,,,,,,,
I want to decorate one wall in the hallway. Please give ideas., Banking,,,,,,,,
Can you tell me about the symptoms of sore throat?, Banking,,,,,,,,
Does living in polluted areas cause sore throat?, Banking,,,,,,,,
Could muscle ache also cause throat infection?, Banking,,,,,,,,
post- and pre futures stock market, Advisory Services,,,,,,,,
ImmunoCellular Therapeutics (IMUC) Pres/CEO, Dr. Manish Singh, leaves, Banking,,,,,,
Tick Value, Banking,,,,,,,,
Financial analysis dilemma, Advisory Services,,,,,,,,
Vaccine Targets Malignant Brain Cancer Antigens, Significantly Lengthens Survival, Banking,,,,,,,
Mutual Fund Performance Reporting Differences, Loan,,,,,,,,
IMUC's Data From Phase I Trial of ICT-107 Accepted for Publication in Medical Journal , Banking,,,,,,,,
Confusion in calculating Present Value in Annuity, Banking,,,,,,,,
OncoSec (ONCS)- GREAT feature article on Market Playground, Real Estate,,,,,,,,
Galena Biopharma (GALE), Banking,,,,,,,,
Advanced Medical Isotope Corp (stock ticker ADMD), Advisory Services,,,,,,,,
Scope of Retail Investment iin India, Banking,,,,,,,,
The #1 Investment in 2012, Banking,,,,,,,,
New Here and Would Like To Learn About Investing., Real Estate,,,,,,,,
Margin investing, Real Estate,,,,,,,,
How to find a sponsor for a school, Banking,,,,,,,,
What are the facilities offered by Emirates islamic bank for easy home loans?, Banking,,,,,,,,
optiontips.in, Banking,,,,,,,,
What to invest in and what to stay away from, Advisory Services,,,,,,,,
Hi Everybody, Banking,,,,,,,,
Financial instruments, such as BG, SBLC, POF or MTN,, Banking,,,,
"Fresh cut bank instrument for lease/sale, such as BG,SBLC, MTN, Bank Bonds", Banking,SBLC, MTN, Bank Bonds,,,,,
What are the payment options available as part of the cash management solutions?, Banking,,,,,,,,
Calculating Rate of Return (ROR), Loan,,,,,,,,
What are the features offered by banks for day to day banking?, Banking,,,,,,,,
What should an easy auto loan entail?, Loan,,,,,,,,
what are the types of Emirates islamic flex cards and the key features of these cards, Banking,,,,,,,,
what are my options in terms of loans as part of islamic finance?, Loan,,,,,,,,
Do the best cashback cards offer easy payment plans?, Banking,,,,,,,,
Is smartBUSINES facility support telegraphic transfers?, Banking,,,,,,,,
Can I apply online to check my eligibility for a personal loan?, Loan,,,,,,,,
Personal banking these title please help, Loan,,,,,,,,
Which leading islamic bank provides the best treasury solutions?, Banking,,,,,,,,
Does any bank offer payroll solutions in UAE?, Banking,,,,,,,,
What are the features to look for in good personal finance schemes in UAE?, Loan,,,,,,,,
Is it even possible to find money to buy a piece of real estate?, Advisory Services,,,,,,,,
Trying to get a personal loan..., Loan,,,,,,,,
I want to open 2 saving account in the same bank? What are my options?, Banking,,,,,,,,
I want to shift from an apple phone to an android based phone and want to know., Banking,,,,,,,,
What are the profit rates I can expect  for a 6 month overdraft investments., Banking,,,,,,,,
First time home buyer, Loan,,,,,,,,
Desperately seeking a personal loan, Loan,,,,,,,,
Probability of Getting this Business Loan?, Loan,,,,,,,,
What all benefits should one look for in a bank scheme offering financing against., Banking,,,,,,,,
What are the features one should look for in a good child saving account?, Banking,,,,,,,,
I live in Kuwait and want to invest in a firm that trades on US stock exchanges., Advisory Services,,,,,,,,
personal credit next to hit the fan, Loan,,,,,,,,
bank loan robbery?, Banking,,,,,,,,
Balloon Loan?, Loan,,,,,,,,
Pay Cash or Finance a Car, Advisory Services,,,,,,,,
Car loan question, Loan,,,,,,,,
Personal Loans, Loan,,,,,,,,
Advice on a personal loan, Loan,,,,,,,,
Need Unsecured loan advice, Loan,,,,,,,,
can I get a loan anywhere?, Loan,,,,,,,,
Need Advice! Should I borrow funds from my Annuity & 401(k)??, Advisory Services,,,,,,,,
Need Better APR: Prosper Loan Balance of $21,500 at 29.97%!, Loan,,,,,,,
The Unsecured Consolidation Loan - How Will it Benefit You?, Loan,,,,,,,,
Bank of America under investigation, Banking,,,,,,,,
Medical School Loans, Loan,,,,,,,,
Looking for legit DPM companies, Banking,,,,,,,,
Is Bankruptcy the right option?, Banking,,,,,,,,
advice needed, Advisory Services,,,,,,,,
In arrears, Agreement in place, Local bank wont see me ?? Help plaese, Banking,,,,,,
Questions on business debt?, Loan,,,,,,,,
Student Loan Terms & Repayment Extensions, Loan,,,,,,,,
Overdraft Help, Banking,,,,,,,,
What Happens To Credit Score After Bankruptcy?, Banking,,,,,,,,
How to pay bills while in college full-time, Advisory Services,,,,,,,,
use home equity line of credit?, Loan,,,,,,,,
Debt Settlement is a good option, but here are concerns when looking at companies., Advisory Services,,,,,,,
Baby Steps and Debt, Advisory Services,,,,,,,,
Credit Car Debt, Loan,,,,,,,,
credit card debt, Banking,,,,,,,,
Debt Settlement Capital One, Advisory Services,,,,,,,,
Who Should File Chapter 13?, Banking,,,,,,,,
Silly Question on Interest Rates, Banking,,,,,,,,
Question on the next couple of years, Banking,,,,,,,,
Help! Help! Help!, Banking,,,,,,,,
what would you do?, Banking,,,,,,,,
Are we in trouble, Banking,,,,,,,,
How to build Cash Flow System, Banking,,,,,,,,
Seeking An Alternative Way To Finance Our Dubai Jamira Tower Ii Project, Advisory Services,,,,,,,,
International Sales Data, Banking,,,,,,,,
Hi All, Banking,,,,,,,,
A Credit Note, Credit Card,,,,,,,,
Need a loan, Loan,,,,,,,,
How to buy an Incorporation, Banking,,,,,,,,
Hello Everyone, Banking,,,,,,,,
hello, Banking,,,,,,,,
Hello from San Francisco, CA, Banking,,,,,,,
ratios to consider when exiting a private equity investment, Banking,,,,,,,,
Who do recessions hurt?, Banking,,,,,,,,
projects awaiting for investment, Banking,,,,,,,,
Do all vaccines cause fever?, Banking,,,,,,,,
Hello people, Banking,,,,,,,,
What's up everyone , Banking,,,,,,,,
Hello from NY, Banking,,,,,,,,
How to calculate interest for 18 ,24, 30 and 36 months ??!!, Banking,,,,,,
Q on co. that makes S&P 200, Banking,,,,,,,,
Corporate labor costs question, Banking,,,,,,,,
I have been having inconsistent cycles for the last 5 months., Banking,,,,,,,,
I am unsure of which brand of pads to use in Saudi Arabia. Please suggest., Banking,,,,,,,,
Did you ever buy Twitter followers?, Banking,,,,,,,,
Hello everyone, Banking,,,,,,,,
hello....., Banking,,,,,,,,
Hello!!!, Banking,,,,,,,,
dissertation??, Banking,,,,,,,,
Anyone heard of Lunden Investments?, Banking,,,,,,,,
Background checks?, Banking,,,,,,,,
Do LED spotlights give good spread?, Banking,,,,,,,,
Are LED lights always better for home use?, Loan,,,,,,,,
Do you get assorted cutlery sets online?, Banking,,,,,,,,
hello to all, Banking,,,,,,,,
Hi from Turkey :), Banking,,,,,,,,
Hello everyone, Banking,,,,,,,,
not sure which masters to go for..., Banking,,,,,,,,
need tips for investing in local businesses, Advisory Services,,,,,,,,
posting expenses on biz plan projections, Banking,,,,,,,,
Which chopping boards are better - wooden or polyethylene?, Banking,,,,,,,,
Do you get good furniture online?, Banking,,,,,,,,
Which are the best rugs for bedrooms?, Banking,,,,,,,,
Hi guys, Banking,,,,,,,,
Hi from Santa Barbara, CA, Banking,,,,,,,
Hello from Hong Kong, Banking,,,,,,,,
Monthly payment on a loan, Loan,,,,,,,,
Do you get automatic cabinet lights?, Banking,,,,,,,,
Suggest some corner wardrobes., Banking,,,,,,,,
Are woolen blankets the best?, Banking,,,,,,,,
Suggest simple designs of wash basins?, Banking,,,,,,,,
Hi Everyone, Banking,,,,,,,,
Hiya Everybody, Banking,,,,,,,,
My first post, Banking,,,,,,,,
What are contemporary finishes in modular kitchen?, Banking,,,,,,,,
How to make life convenient in case of incontinence?, Advisory Services,,,,,,,,
I am newly married and we have just moved into our house. Provide d\xe9cor ideas?, Banking,,,,,,,,
introduction, Banking,,,,,,,,
Worried of staining my clothes during periods,have long working hours.What can I do?, Banking,,,,,,,
Suggest good practice for urine incontinence?, Banking,,,,,,,,
Suggest a good tip for elderly people who suffer from incontinence?, Banking,,,,,,,,
Bank writes option - Does this contributes to it's credit risk , Banking,,,,,,,,
Equity listing changes, Banking,,,,,,,,
Analyse Bond Yields with Excel, Banking,,,,,,,,
mortgage Backed Securities, Mortgage,,,,,,,,
What determines going interest rates and premium/discounts, Banking,,,,,,,,
Can you help me decide on a good investment management firm in Kuwait for alternate, Banking,,,,,,,,
CAPM and stock pricing, Advisory Services,,,,,,,,
Discounting to present value, Banking,,,,,,,,
Eps, Banking,,,,,,,,
Is forex trading a reliable source for long term investment?, Banking,,,,,,,,
Are credit cards really helpful?, Credit Card,,,,,,,,
Ways of generating income at home?, Loan,,,,,,,,
Eps, Banking,,,,,,,,
Reverse stop loss, Banking,,,,,,,,
Buy my Investment?, Banking,,,,,,,,
I often get skin darkening when I use hair removal products. Why is it so?, Banking,,,,,,,,
Low Income Housing Grants Available, Loan,,,,,,,,
Obama Grants For Single Moms To Pay Bills and Debts, Advisory Services,,,,,,,,
Rights issuance, Banking,,,,,,,,
Will the outperformance of GCC Large cap Stocks continue?, Banking,,,,,,,,
Biotech investment options, Banking,,,,,,,,
Get Your Free Personal Money Grants To Pay Off All Essential Bills And Debts, Advisory Services,,,,,,,,
Grant Funding Opportunities From Federal Agencies, Banking,,,,,,,,
Learn Quran Online With Tajweed | Quran For Kids Online Institute, Banking,,,,,,,,
Help Required in CAPM, Banking,,,,,,,,
Reverse Stock Split and Capital Reduction, Advisory Services,,,,,,,,
Share Analysis Tool., Banking,,,,,,,,
Anyone familiar with this, Banking,,,,,,,,
Is Service Tax applicable if Work done but payment is disputed?, Banking,,,,,,,,
I need some personal loan but I am not sure whether I am eligible for the same., Loan,,,,,,,,
Simple Investment Question, Banking,,,,,,,,
401k Problem, Advisory Services,,,,,,,,
What is reasonable return?, Banking,,,,,,,,
Why Auto companies on top gear, Loan,,,,,,,,
,BUY IELTS,DIPLOMAS,TOEFL,TOEIC,DL,ID,SSN/SSC ( picoloperes@gmail.com )Passport,Birth, Loan
Ian Filippini and filippini Financial Group, Advisory Services,,,,,,,,
Live Stock Market Updates - Nifty hovers around 8,750 mark ahead of RBI policy, Advisory Services,,,,,,,
What all services does NBK Capital offer for online share trading?, Loan,,,,,,,,
What was NBK Capital's role in the Multiband  deal? , Loan,,,,,,,,
Credit Score Increased by RentReporters, Banking,,,,,,,,
How To Beat Credit Card Companies, Credit Card,,,,,,,,
Which should be paid off first - HELOC or Student Loan?, Loan,,,,,,,,
Should I pay off our credit cards???, Banking,,,,,,,,
What Happens To Credit Score After Bankruptcy?, Banking,,,,,,,,
Can Bankruptcy Prevent Me From Getting A Job?, Advisory Services,,,,,,,,
Philadelphia has launched a Tax Amnesty Program, Banking,,,,,,,,
Help with credit / balance transfer, Banking,,,,,,,,
I don't know what to do , Banking,,,,,,,,
pay-off consequences, Advisory Services,,,,,,,,
Military Member in need of help!, Banking,,,,,,,,
Am I on the right track?, Banking,,,,,,,,
I have no idea where to start... Help?, Loan,,,,,,,,
Selling uninsured debt, Advisory Services,,,,,,,,
Debt Settlement \u2013 Offering a Way out of Bankruptcy, Advisory Services,,,,,,,,
Bankruptcy, Banking,,,,,,,,
Interest on Debt, Banking,,,,,,,,
making minimum payments, Banking,,,,,,,,
Should I hire an Attorney or File myself (Pro Se)?, Banking,,,,,,,,
New Here =), Banking,,,,,,,,
edison patrick and associates, Banking,,,,,,,,
hi everyone., Banking,,,,,,,,
hello new here, Banking,,,,,,,,
Newbie Introduction, Banking,,,,,,,,
new undergrad interested in finance here, Advisory Services,,,,,,,,
General terms of a personal loan., Loan,,,,,,,,
Hello.., Banking,,,,,,,,
hello, Banking,,,,,,,,
Lady Judy is in and Bouncing!, Banking,,,,,,,,
Contract for co-signers?, Banking,,,,,,,,
Desperate Need Of Money?, Advisory Services,,,,,,,,
Best way to get what I need here., Advisory Services,,,,,,,,
Hello Everybody, Banking,,,,,,,,
New here, Banking,,,,,,,,
Hello, Banking,,,,,,,,
Should I qualify?, Banking,,,,,,,,
lost W-2, Banking,,,,,,,,
Car Title Loan in Los Angeles?, Loan,,,,,,,,
Hello friends, Banking,,,,,,,,
Hi From Diehl, Banking,,,,,,,,
Need Knowledge to Reach My Financial Goals, Advisory Services,,,,,,,,
HELP ME PLEASE!!!! personal loan, Loan,,,,,,,,
Having to repay college loans but still in school, Loan,,,,,,,,
need finance coaching, Advisory Services,,,,,,,,
Cosmo M. Bosco says Hello, Banking,,,,,,,,
Hello (Help w/Judgments), Banking,,,,,,,,
Hello All, Banking,,,,,,,,
Need advice on how to pay for school, Advisory Services,,,,,,,,
In Need of personal loan, any help???, Loan,,,,,,,
Help Please, Banking,,,,,,,,
Hi, Banking,,,,,,,,
Hi!, Banking,,,,,,,,
Hi Everyone, Banking,,,,,,,,
Small loan, Loan,,,,,,,,
