How Blended Gross Profit Margin is Calculated, Banking,,,,,,,,
Where should I invest money for getting higher return?, Advisory Services,,,,,,,,
"Digital currency in Dubai from Jan, 2018??", Middle East,,,,,,,,
Future of Cryptocurrencies and Role of Money Trade Coin in the market, Advisory Services,,,,,,,,
How is Money Trade Coin Gaining base in the Crypto world?, Advisory Services,,,,,,,,
"lease/sale, such as BG,SBLC, MTN, Bank Bonds", Banking,,,,,,,,
Safer Results in Trading with Money Trade Coin, Advisory Services,,,,,,,,
What makes Money Trade coin a Perfect Option for International Transactions, Advisory Services,,,,,,,,
GST Rules, Banking,,,,,,,,
I have heard that Abdul Latif Jameel offer financial services also. Can you elaborate, Advisory Services,,,,,,,,
Dinar boxes metallic from paraguay, Banking,,,,,,,,
Introducing our financial instruments for funding/financing, Advisory Services,,,,,,,,
Bitcoin jumps more than 9% after news Square is testing the digital currency, Banking,,,,,,,,
How can I Illegally change My Identity Completely, Banking,,,,,,,,
I Need money transfer service in Melbourne Australia, Advisory Services,,,,,,,,
What is your biggest money problem?, Advisory Services,,,,,,,,
What do banks look for when reviewing a loan application?, Loan,,,,,,,,
List of the business which are not included in the VAT, Loan,,,,,,,,
SWIFT MT sequence, Banking,,,,,,,,
What is International Bill of Exchange (UNCITRAL)?, Banking,,,,,,,,
I am interested in entering a partnership with a firm that offers vehicle distributor, Investment,,,,,,,,
I thought Abdul Latif Jameel was an automotive distributor but heard that they offer, Advisory Services,,,,,,,,
Need car insurance, Insurance,,,,,,,,
online car insurance, Insurance,,,,,,,,
Where can I get the best car insurance?, Insurance,,,,,,,,
I need a loan for my auto insurance company that I am planning to start., Loan,,,,,,,,
How to Plan a Travel?, Banking,,,,,,,,
Life Insurance Buying Tips, Insurance,,,,,,,,
Term Life Insurance, Insurance,,,,,,,,
Beware of Insurance Company tricks., Insurance,,,,,,,,
Insurance, Insurance,,,,,,,,
Ten Benefits of Long Term Insurance, Insurance,,,,,,,,
Business Insurance For The Best Benefits, Insurance,,,,,,,,
The main reason for growth of insurance in developing countries:, Insurance,,,,,,,,
Best Insurance to buy in india, Insurance,,,,,,,,
Help!! where can i get a business INSURANCE??, Insurance,,,,,,,,
Digital Marketing Service For You, Banking,,,,,,,,
My brother has got a Islamic insurance but will I be able to claim it?, Insurance,,,,,,,,
Types of insurance-, Insurance,,,,,,,,
Benefits of life insurance policy?, Insurance,,,,,,,,
Is Reverse Mortgages Useful?, Banking,,,,,,,,
Home loan Vs Loan against property, Loan,,,,,,,,
today's mortgage rates?, Mortgage,,,,,,,,
Mortgage advice, Advisory Services,,,,,,,,
Free Money Guaranteed Software Scam, Advisory Services,,,,,,,,
What are the best home loan options available in Surat?, Loan,,,,,,,,
What are the best home loan options available in Vadodara?, Loan,,,,,,,,
Guidance For Online Mortgage Prequalification, Mortgage,,,,,,,,
Stock market is compromise!!! Please read, Advisory Services,,,,,,,,
What are the Signs of a Scam?, Financial Scam,,,,,,,,
how much do i need to protect my computer?, Banking,,,,,,,,
Types of FHA loan, Loan,,,,,,,,
We Offer Financial and Loan Service, Loan,,,,,,,,
House loan I am entitled to be a priority banking member, Banking,,,,,,,,
Be safe and secure from fraud & Scams, Banking,,,,,,,,
Sydney System is a SCAM! Beware, Financial Scam,,,,,,,,
"Buy ID Card,Driving License,Passport(originaldocumentation@outlook.com )", Advisory Services,,,,,,,,
I want to take a house loan from a bank in UAE. What are the benefits that I will get, Banking,,,,,,,,
Mortgage advice, Advisory Services,,,,,,,,
"Buy ID Card,Driving License,Passport(originaldocumentation@outlook.com )", Advisory Services,,,,,,,,
Binadroid is a BIG SCAM!, Financial Scam,,,,,,,,
The NEW Auto Trading Software Drexel Code Is a Scam, Financial Scam,,,,,,,,
Triana Soft IS a SCAM!, Financial Scam,,,,,,,,
Help for a Car Loan, Loan,,,,,,,,
Buy Authentic Counterfeit Banknotes(currencyproducers@gmail.com), Loan,,,,,,,,
First time homebuyer. I kind of need help., Banking,,,,,,,,
Suing my irresponsible business partner., Loan,,,,,,,,
Need to know if I'm getting ripped off :/ , Advisory Services,,,,,,,,
Buy Authentic Counterfeit Banknotes(currencyproducers@gmail.com), Loan,,,,,,,,
Residential finance, Advisory Services,,,,,,,,
Non-homeowner buy-to-let mortgage, Mortgage,,,,,,,,
",BUY IELTS,DIPLOMAS,TOEFL,TOEIC,DL,ID,SSN/SSC ( picoloperes@gmail.com )Passport,Birth", Loan,,,,,,,,
STOCK MARKET IS COMPROMISE!!! Part 2 Airline Industry, Advisory Services,,,,,,,,
Has anyone had dealings with this company?, Loan,,,,,,,,
",BUY IELTS,DIPLOMAS,TOEFL,TOEIC,DL,ID,SSN/SSC ( picoloperes@gmail.com )Passport,Birth", Banking,,,,,,,,
Why are Toronto mortgage agents a safe bet?, Mortgage,,,,,,,,
trade x confidential scam, Financial Scam,,,,,,,,
Limitless Profit Scam!, Financial Scam,,,,,,,,
Trade Fusion scam, Financial Scam,,,,,,,,
Crowdfunding Scams, Banking,,,,,,,,
Why should I retire early?, Banking,,,,,,,,
retirement in partnership firm, Retirement Plan,,,,,,,,
Retirement planning in young age, Advisory Services,,,,,,,,
Roth or not?, Banking,,,,,,,,
Pay student loan or fund retirement?, Loan,,,,,,,,
"Retirement soon, transfer all stocks to stable value fund?", Retirement Plan,,,,,,,,
What will you do after retirement?, Retirement Plan,,,,,,,,
What is the best way to save for retirement after 40?, Advisory Services,,,,,,,,
retirement plan options boston MA, Retirement Plan,,,,,,,,
Saving for retirement question, Retirement Plan,,,,,,,,
GST software, Banking,,,,,,,,
financial advisor?, Advisory Services,,,,,,,,
When should one start thinking about saving for retirement?, Retirement Plan,,,,,,,,
Age to retire?, Retirement Plan,,,,,,,,
Top Tips And Advice To Build Your Retirement Nest Egg, Advisory Services,,,,,,,,
Invest For Your Future, Advisory Services,,,,,,,,
Retired Parent Question, Banking,,,,,,,,
"Buy ID Card,Driving License,Passport(originaldocumentation@outlook.com )", Advisory Services,,,,,,,,
I'd like some thoughts about a question , Banking,,,,,,,,
Can you help me with this finance problem ?, Advisory Services,,,,,,,,
I  have been hearing great reviews about Abdul Latif Jameel offering funding, Advisory Services,,,,,,,,
I am an investor and want to get into the KSA  real estate market. Would it be a prof, Real Estate,,,,,,,,
I am interested in investing in a good residential project in KSA., Investment,,,,,,,,
Is real estate a bad investment?, Real Estate,,,,,,,,
What is the best time to invest in real estate?, Real Estate,,,,,,,,
What are the characteristics of a successful real estate agent?, Real Estate,,,,,,,,
How do I become a successful real estate agent?, Real Estate,,,,,,,,
What is the difference between a real estate agent and a real estate broker?, Real Estate,,,,,,,,
How can I learn everything about real estate investing?, Real Estate,,,,,,,,
How is technology changing real estate?, Real Estate,,,,,,,,
What is real estate boom?, Real Estate,,,,,,,,
What is the best real estate marketing tool?, Real Estate,,,,,,,,
"Why is real estate called ""real estate""?", Real Estate,,,,,,,,
What is the best way to invest in real estate?, Advisory Services,,,,,,,,
What makes a good real estate agent?, Real Estate,,,,,,,,
Why is real estate called real estate?, Real Estate,,,,,,,,
How do you market real estate?, Real Estate,,,,,,,,
How do you market real estate?, Real Estate,,,,,,,,
What is the best advice for someone getting into real estate?, Advisory Services,,,,,,,,
Why are there no startups solving real estate problems?, Real Estate,,,,,,,,
How can I take loan for starting my business?, Loan,,,,,,,,
Money Trade coin is next bitcoin, Advisory Services,,,,,,,,
How to get a business loan in India?, Loan,,,,,,,,
financial advisor, Advisory Services,,,,,,,,
I am interested in investing in consumer goods sector in KSA., Investment,,,,,,,,
What kind of work does Abdul Latif Jameel do in terms of marketing?, Advisory Services,,,,,,,,
NPV case study question, Banking,,,,,,,,
What should I expect in the loan process?, Loan,,,,,,,,
I have a debit card and now I want to give my wife one too. Is it possible to get, Banking,,,,,,,,
Which bank is best?, Banking,,,,,,,,
Are challenger/digital banks risky?, Banking,,,,,,,,
"PerfectMoney, Paypal, Skrill, Payza, WebMoney, BitCoin : Buy, Se", Advisory Services,,,,,,,,
How to double bitcoin in 100 hours, Investment,,,,,,,,
How can I get 100% home loan?, Loan,,,,,,,,
Credit card or Mobile payment?, Credit Card,,,,,,,,
Are there any surrender charges on Emirates Islamic's Ethra'a's plans?, Banking,,,,,,,,
Are there any surrender charges on Emirates Islamic's Ethra'a's plans?, Banking,,,,,,,,
I am planning to start with online banking. Is it a safe mode of bill payment, Banking,,,,,,,,
Can I hide my loan history in my CIBIL report?, Loan,,,,,,,,
APPLY FOR LOAN:mutualfundsoffer@gmail.com, Loan,,,,,,,,
What is merchant account?, Banking,,,,,,,,
9 steps to improve your credit rating, Credit Score,,,,,,,,
I want a credit card that would give me benefits for my business. Please help., Credit Card,,,,,,,,
which are the best schools with affordable fees in Dubai?, Middle East,,,,,,,,
I am new in Abu Dhabi and want to apply a good credit card that would give me travel, Credit Card,,,,,,,,
I am planning to open an account under corporate banking of Emirates Islamic., Banking,,,,,,,,
I have just got phone banking for my savings account. Will I be able to pay my phone, Banking,,,,,,,,
"How to open a offshore bank account, hassle-free?", Banking,,,,,,,,
Tax in Dubai, Middle East,,,,,,,,
I plan to make investments for future requirements. Do banks offer personalized..., Banking,,,,,,,,
ways of business financing, Banking,,,,,,,,
"BUY HIGH QUALITY DRIVER'S LICENSE,ID'S,PASSPORTS deltonmicheal@gmail.com", Loan,,,,,,,,
Loan offer and all financial services, Loan,,,,,,,,
Credit Ratting is important for finance to business, Banking,,,,,,,,
What is best Credit Card in UAE ?, Credit Card,,,,,,,,
What is besic use of credit card, Credit Card,,,,,,,,
Needing Advice, Advisory Services,,,,,,,,
National Investment Banking Competition: OPEN, Banking,,,,,,,,
Suggest a bank?, Banking,,,,,,,,
Savings Account?, Banking,,,,,,,,
Why you should learn the art of losing in forex, Banking,,,,,,,,
I need a business loan to run my salon, Loan,,,,,,,,
My Story About Getting Successful Loans, Loan,,,,,,,,
What is your credit score?, Banking,,,,,,,,
Safety of plastic money at stake!, Advisory Services,,,,,,,,
How To Improve Your Credit Score, Credit Score,,,,,,,,
Free movie tickets at Vox Cinemas, Banking,,,,,,,,
I am looking for a sharia compliant credit card in dubai. Where can I consult for it?, Credit Card,,,,,,,,
Don't take that cash advance! , Loan,,,,,,,,
Do banks offer different type of business banking packages?, Banking,,,,,,,,
I want to know more about the union coop tamayaz card. Any idea if the card is worth, Banking,,,,,,,,
I am looking to open a bank account for my son who has entered college. Any good bank, Banking,,,,,,,,
Amazing three tips to become a professional trader, Advisory Services,,,,,,,,
Bridge financing on Trust funds ?, Banking,,,,,,,,
Personal loan rejected, Loan,,,,,,,,
What is the Difference between Unsecured and Secured Loans?, Loan,,,,,,,,
How can I get loan for business?, Loan,,,,,,,,
How to check your credit rating?, Banking,,,,,,,,
3 Myths to Get Rid of Bad Credit Scores, Banking,,,,,,,,
Do Islamic Banks in UAE offer good credit card options?, Banking,,,,,,,,
Need of Advice, Advisory Services,,,,,,,,
Are mobile wallets going to replace credit cards?, Banking,,,,,,,,
Credit Card Protection from Yourself, Credit Card,,,,,,,,
How is priority banking made possible? Any leading banks in dubai offering it?, Banking,,,,,,,,
I wish to explore if there is variety in the types of debit cards with banks in dubai, Banking,,,,,,,,
I am looking for prepaid card for managing my personal expenses and wish to opt..., Banking,,,,,,,,
Online bank account, Banking,,,,,,,,
How to get a business loan in India?, Loan,,,,,,,,
"Monthly loan, 10% interest rate personal legal finance company", Loan,,,,,,,,
I want to take a loan for my son's wedding. How can I know my eligibility? , Loan,,,,,,,,
My sister stole my identity - now my credit history is crap, Banking,,,,,,,,
"Buy ID Card,Driving License,Passport(originaldocumentation@outlook.com )",Advisory Services,,,,,,,,
Financial bank instruments for Lease and sale for trade and project finance., Banking,,,,,,,,
I want to get a business card. What's the best deal I can get? , Credit Card,,,,,,,,
What is the besic use of EMV Credit Card, Credit Card,,,,,,,,
Can I make money by Using credit cards., Credit Card,,,,,,,,
Does a personal loan calculator give accurate information about the eligibility..., Loan,,,,,,,,
Private Loan service get an easy loan term, Loan,,,,,,,,
APPLY FOR LOAN:mutualfundsoffer@gmail.com, Loan,,,,,,,,
",BUY IELTS,DIPLOMAS,TOEFL,TOEIC,DL,ID,SSN/SSC ( picoloperes@gmail.com )Passport,Birth",Loan,,,,,,,,
Buy Authentic Counterfeit Banknotes(currencyproducers@gmail.com), Loan,,,,,,,,
"Exchange Amazon Gift cards, Neosurf, PCS coupon/voucher, Paysafecard, NeoCode, Trans", Banking,,,,,,,,
Where can I find a credit card with really low APR/interest rate?, Credit Card,,,,,,,,
Credit card company not following agreed upon terms., Credit Card,,,,,,,,
"Buy ID Card,Driving License,Passport(originaldocumentation@outlook.com )", Advisory Services,,,,,,,,
Yaser chartered accountants, Advisory Services,,,,,,,,
"Which is better, a fixed or variable rate loan?", Loan,,,,,,,,
Good Site Of Personal Loan, Loan,,,,,,,,
I need a personal loan super fast, Loan,,,,,,,,
Getting Credit Reports While Maintining Free Speech, Advisory Services,,,,,,,,
STOCK MARKET IS COMPROMISE!!! Part 2 Airline Industry, Advisory Services,,,,,,,,
Stock market is compromise!!! Please read, Advisory Services,,,,,,,,
Credit Card Payment Services, Credit Card,,,,,,,,
best auditing services company in dubai, Loan,,,,,,,,
"Exchange PCS coupon, Neosurf, Transcash, Bitcoin, Solidtrustpay, Ethereum, Ripple, Li", Banking,,,,,,,,
Useful Design Tools, Banking,,,,,,,,
Signatures, Banking,,,,,,,,
Help for setting up a business, Loan,,,,,,,,
I want to take a personal loan for my child's education. Can I take it against some, Loan,,,,,,,,
How to get a car loan in India?, Loan,,,,,,,,
"Buy Driver's License, Passport,   ((whatsapp +237679499813)))", Banking,,,,,,,,
Can anybody tell me the best bank to buy motor insurance in UAE, Banking,,,,,,,,
This site is awsome, Banking,,,,,,,,
advertising on this site, Banking,,,,,,,,
"Buy ID Card,Driving License,Passport(originaldocumentation@outlook.com )", Advisory Services,,,,,,,,
How to get Approved for a Personal Loan?, Loan,,,,,,,,
Urgent Need of Financial Help, Advisory Services,,,,,,,,
What is suspended interest?, Banking,,,,,,,,
Need advice, Advisory Services,,,,,,,,
"Exchange/Buy/Sell  PCS coupon, Bitcoin, Solidtrustpay, Ethereum, Ripple, Litecoin, NE", Bitcoin,,,,,,,,
Car Insurance in UAE, Insurance,,,,,,,,
Life Insurance in Dubai, Insurance,,,,,,,,
"Exchange / Sell Transcash, Neosurf, PCS coupon/voucher, Paysafecard, NeoCode, Amazon,", Banking,,,,,,,,
Today Karachi Gold Price | Karachi Stock Exchange 100 Index, Advisory Services,,,,,,,,
salary certificate compulsory?, Banking,,,,,,,,
"Share Price, PER", Banking,,,,,,,,
Bitcoin hits a new high, Bitcoin,,,,,,,,
Need advice, Advisory Services,,,,,,,,
Yaser chartered accountants, Advisory Services,,,,,,,,
Hi there!, Banking,,,,,,,,
buy fake passports id cards drivers license green cards etc-((mussaabu81@gmail.com)), Loan,,,,,,,,
I am looking for some good insurance scheme. Where can I go in UAE?, Insurance,,,,,,,,
#100% Financial Instrument BGs/SBLCs/LCs for Trade and Project Funding, Advisory Services,,,,,,,,
Wearable technologies and banking?, Banking,,,,,,,,
"Buy real euro,dollar and other currencies(uniqueproducers@yandex.com)", Loan,,,,,,,,
Forum & Youtube, Banking,,,,,,,,
Selling Long term Treasuries - How does this effect the yield curve?, Banking,,,,,,,,
Buy-and hold abnormal returns, Banking,,,,,,,,
Do My Finance Homework, Advisory Services,,,,,,,,
"NYSE files to list bitcoin ETFs, bringing cryptocurrency a step closer to mainstream", Banking,,,,,,,,
Debt Consolidation loan preferable?, Advisory Services,,,,,,,,
Vat, Banking,,,,,,,,
The essence of the facts, Banking,,,,,,,,
What features does the Toyota Prius pack?, Banking,,,,,,,,
I am interested in the Yaris. Is the Toyota Yaris a 4 or 6 cylinder car?, Loan,,,,,,,,
Hey Everyone, Banking,,,,,,,,
Hello everyone, Banking,,,,,,,,
Introduction, Banking,,,,,,,,
TCP Permit Application California, Banking,,,,,,,,
Best Lifequote & Insurance Service Ever, Insurance,,,,,,,,
"Buy ID Card,Driving License,Passport(originaldocumentation@outlook.com )", Advisory Services,,,,,,,,
"CMA (US) Promotion Continues till FEB 15th, 2015", Banking,,,,,,,,
Introducing New Finance & Business site, Advisory Services,,,,,,,,
i have an Idea, Banking,,,,,,,,
anyone can help with this problem?, Advisory Services,,,,,,,,
I have been reading about Emirates Islamic's Supply Chain solutions. What all do they , Banking,,,,,,,,
Question about after-tax CF, Banking,,,,,,,,
Bitcoin hits new price $10000, Bitcoin,,,,,,,,
How are banking stocks performing? Is it a worthy bet?, Banking,,,,,,,,
Welcome to Blusignalsystems, Advisory Services,,,,,,,,
How do I pay off all my debts?, Advisory Services,,,,,,,,
Auto title loan advice needed, Loan,,,,,,,,
Why debit/credit card have 4 digit pin rather longer one?, Credit Card,,,,,,,,
What are the latest GST rules in India?, Loan,,,,,,,,
How to save your investment in Forex industry, Banking,,,,,,,,
"BG,SBLC,LC,DLC Funding for project FOR LEASE", Banking,,,,,,,,
Please suggest a car which will be good for city as well as long distance travelling?, Loan,,,,,,,,
What restaurants are famous in the Bahamas?, Banking,,,,,,,,
There is a major dearth of power in the world., Banking,,,,,,,,
Hi all, Banking,,,,,,,,
Glad to be here, Banking,,,,,,,,
"Hi, I'm Fixbit.", Banking,,,,,,,,
Get TCP License, Banking,,,,,,,,
Best Depression Service, Banking,,,,,,,,
",BUY IELTS,DIPLOMAS,TOEFL,TOEIC,DL,ID,SSN/SSC ( picoloperes@gmail.com )Passport,Birth", Loan,,,,,,,,
Please try to prevent the spam posts, Banking,,,,,,,,
Posting a external link earns a permanent account ban? Very fair and friendly, Banking,,,,,,,,
Congratulations! You have just managed to disgust a new member in 3 days!, Banking,,,,,,,,
Long Currency Straddles and Short Currency Straddles, Banking,,,,,,,,
What is the best company to start trading in stocks?, Loan,,,,,,,,
"Dissertation topic, please help", Banking,,,,,,,,
Automated trading, Banking,,,,,,,,
Broker matters a lot?, Banking,,,,,,,,
Do you want to live a debt-free life?, Advisory Services,,,,,,,,
Debt Consolidation, Advisory Services,,,,,,,,
What is HSN code ?, Banking,,,,,,,,
How to reduce toxic backlinks?, Banking,,,,,,,,
"Can win AED 50,000 for using buses, metros in UAE??", Banking,,,,,,,,
Please Help me to solve cash flow estimation problem, Banking,,,,,,,,
cash flow estination problem, Banking,,,,,,,,
What is the work of outdoor advertising agency?, Advisory Services,,,,,,,,
Welcome to www.blusignalsystems.com, Advisory Services,,,,,,,,
I have had dark circles since I was a teenager. What are the factors that cause dark, Banking,,,,,,,,
FundsGlory.Com is Here, Loan,,,,,,,,
"Buy ID Card,Driving License,Passport(originaldocumentation@outlook.com )", Advisory Services,,,,,,,,
Hi everyone, Banking,,,,,,,,
Detailing about cheap car insurance, Insurance,,,,,,,,
Home Insurance Quotes: The five most common myths, Loan,,,,,,,,
STOCK MARKET IS COMPROMISE!!! Part 2 Airline Industry, Advisory Services,,,,,,,,
schedule of receivable, Banking,,,,,,,,
Looking for good stuff online is easy, Banking,,,,,,,,
Please assist me with this problem on Annuity., Advisory Services,,,,,,,,
finance-- evaluate a project, Advisory Services,,,,,,,,
Anyone interested in starting HYIP Business?, Investment,,,,,,,,
Multiple Payment Gateways integerated HYIP Script, Investment,,,,,,,,
What is the greenest way to invest?, Advisory Services,,,,,,,,
Installment Loan Vs credit card help, Banking,,,,,,,,
Worldcore debit card, Banking,,,,,,,,
looking for a financial successful life, Advisory Services,,,,,,,,
telephone banking, Banking,,,,,,,,
Watch out for Chase bank!, Banking,,,,,,,,
Never say never?, Banking,,,,,,,,
What do you mean by cost of sales, Banking,,,,,,,,
Do you want to establish yourself as a professional trader, Advisory Services,,,,,,,,
Fresh cut bank instrument for lease/sale, such as BG,SBLC, MTN, Bank Bonds, Banking,,,,
I am planning to travel to Dubai during Christmas Eve. Is it a good time to travel..., Middle East,,,,,,,,
Is bladder infection a common cause for urine incontinence? Need to know more., Banking,,,,,,,,
Which resort should I plan on staying at Los Cabos while vacationing in Mexico?, Banking,,,,,,,,
Hi guys, Banking,,,,,,,,
Hello! Please, Read my Introduction!, Banking,,,,,,,
Hello Friends, Banking,,,,,,,,
Stock market is compromise!!! Please read, Advisory Services,,,,,,,,
Tips for Buying Long Term Health Care Insurance, Insurance,,,,,,,,
Best Medical insurance company.., Insurance,,,,,,,,
Is NestAway a reliable house renting service provider?, Banking,,,,,,,,
Which of these degrees is more related to Finance?, Advisory Services,,,,,,,,
Which D/E ratio to use for WACC here?, Banking,,,,,,,,
\xc9change / vente Transcash, Neosurf, PCS coupon / bon, Paysafecard, NeoCode, Amazon, B, Banking,,
Get Knowledgable On Home Mortgages With These Tips, Loan,,,,,,,,
investment, Banking,,,,,,,,
"Bitcoin smashes $6,600 to new record after CME announces plans for future contracts", Banking,,,,,,,,
NPV comparision help, Banking,,,,,,,,
Needing Advice, Advisory Services,,,,,,,,
get your thoughts... What is money?, Advisory Services,,,,,,,,
Need major help with my debt :(, Advisory Services,,,,,,,,
Buy real euro/dollar/pound notes etc(uniqueproducers@yandex.com), Loan,,,,,,,,
Tycoon Channel Trader Service, Advisory Services,,,,,,,,
A Star Claims: is this a scam?, Financial Scam,,,,,,,,
I am interested in taking an auto loan. Will it cover vehicle insurance too?, Loan,,,,,,,,
paumelle de porte réglable  | swing gate hinges |  shivamimpexhinge, Banking,,,,,,,,
I want to construct a house and need a loan for it. Will I get it from a bank?, Banking,,,,,,,,
What range of toys would be ideal to buy? Need to see some styles., Banking,,,,,,,,
Are canopies sturdy and reliable for long term use of children? Any recommendations?, Banking,,,,,,,,
"My budget is SAR 90,000. Will be able to buy the Toyota Camry?", Banking,,,,,,,,
Introduction, Banking,,,,,,,,
Hi guys! New here!, Banking,,,,,,,,
Hi Every One, Banking,,,,,,,,
How To Get The Best Business Insurance Providers?, Insurance,,,,,,,,
Are real estate agents becoming obsolete?, Real Estate,,,,,,,,
What is a good online real estate course?, Real Estate,,,,,,,,
Bitcoin is finally buying into US real estate, Real Estate,,,,,,,,
What is real estate flipping?, Real Estate,,,,,,,,
"Buy passports,ID Card,Driving License,Ssn(originaldocumentation@outlook.com", Advisory Services,,,,,,,,
please, help me in article!!!!, Banking,,,,,,,
Please help me with this question on Foreign exchange risk, Banking,,,,,,,,
.BUY IELTS,DIPLOMAS,TOEFL,TOEIC,DL,ID,SSN/SSC ( picoloperes@gmail.com )Passport,Birth, Loan,
STOCK MARKET IS COMPROMISE!!! Part 2 Airline Industry, Advisory Services,,,,,,,,
Stock market is compromise!!! Please read, Advisory Services,,,,,,,,
401k matching - x% of contributions not exceeding x% of compensation, Banking,,,,,,,,
The BEST Guide for Beginners!, Banking,,,,,,,,
Fresh cut bank instrument for lease/sale, such as BG,SBLC, MTN, Bank Bonds, Banking,,,,
Should I pay down debt or invest, Advisory Services,,,,,,,,
Receive a secured loan, Loan,,,,,,,,
Credit debt, Advisory Services,,,,,,,,
How to protect one self from online fraud..??, Banking,,,,,,,,
How to find hidden camera using mobile???, Banking,,,,,,,,
Financial fraud case of Mattew in 2005, Advisory Services,,,,,,,,
I have a shipping equipment manufacturing unit and want to purchase some more..., Loan,,,,,,,,
Explain about Commodity Market, Real Estate,,,,,,,,
How much does AdSense pay per click?, Advisory Services,,,,,,,,
Can bladder problems be taken care of easily? Need advice., Advisory Services,,,,,,,,
Could you suggest some good restaurant in Dubai?, Banking,,,,,,,,
I heard lot about Kaya's CO2 RE Fractional CO2 Resurfacing System. Can you explain?, Banking,,,,,,,,
Hello Everyone, Banking,,,,,,,,
Dilemma about job, Banking,,,,,,,,
What are the types of Stock Brokers?, Advisory Services,,,,,,,,
What is the best real estate marketing tool?, Real Estate,,,,,,,,
What is Real Estate system?, Real Estate,,,,,,,,
What is real estate benefits?, Real Estate,,,,,,,,
question about how much can be saved in federal income tax, Banking,,,,,,,,
financing issues due to metal building on land, Banking,,,,,,,,
.Buy driving license,id cards,passports (diplomaticdocsassistance@yahoo.co.uk)certifi, Banking,,,,,,
Credit linked subsidy in India, Banking,,,,,,,,
How to invest in stock market?, Advisory Services,,,,,,,,
How should a young person invest money?, Advisory Services,,,,,,,,
Buy powerful & Well-Manged HYIP Script at 50% off., Investment,,,,,,,,
We Offer Financial and Loan Service, Loan,,,,,,,,
Someone please help me. I NEED HELP!!!, Banking,,,,,,,,
how to deal with student loan debt, Loan,,,,,,,,
My #1 rule...., Banking,,,,,,,,
Golds gym ruining my credit!, Credit Card,,,,,,,,
A review on AKJ, a review on AK Jensen Brokerage firm, Banking,,,,,,,
Why is finance so popular?, Advisory Services,,,,,,,,
The perfect way to manage your losing trades, Advisory Services,,,,,,,,
