HI Guys, Banking,,,,,,,,
Just wanna say HELLO, Banking,,,,,,,,
Hello everyone!, Banking,,,,,,,,
www.seekforfunds.com is your one-stop platform to suit your financing needs globally, Advisory Services,,,,,,,,
Toronto Mortgage Agents Can Help You Find Promising House Loans, Loan,,,,,,,,
Buy real euro/dollar/pound notes etc(uniqueproducers@yandex.com), Loan,,,,,,,,
First credit card- good for credit rating??, Credit Card,,,,,,,,
Which Credit Card, Credit Card,,,,,,,,
Consolidation For Credit Cards, Banking,,,,,,,,
Please suggest somebody in Saudi Arabia that has the local knowhow?, Banking,,,,,,,,
Property investment, Banking,,,,,,,,
I have a question about advertising., Banking,,,,,,,,
Get your business funded!, Loan,,,,,,,,
Forex Trading Rules, Banking,,,,,,,,
question on selling a car, Loan,,,,,,,,
tons of stock data needed, Advisory Services,,,,,,,,
outrageous bank fee????, Banking,,,,,,,,
Roth 401k to Roth IRA, Banking,,,,,,,,
Mar Vista, Banking,,,,,,,,
Retirement, Retirement Plan,,,,,,,,
Hi.., Banking,,,,,,,,
Hi there, Banking,,,,,,,,
Need car loan advise, Loan,,,,,,,,
I need some help with some finance issues.., Advisory Services,,,,,,,,
What are the different kinds of credit cards; banks in UAE offer?, Banking,,,,,,,,
Need help with student credit cards, Loan,,,,,,,,
Code of Conduct for Canadian Credit Card Issuers, Banking,,,,,,,,
$15000 credit cards debt what do i do, Advisory Services,,,,,,,,
Procedure for trasferring property through will, Loan,,,,,,,,
Buying Home in Phuket, Loan,,,,,,,,
Easy tips for sell a home or property very fast, Loan,,,,,,,,
I want to invest in real estate in Kuwait. How best can I do it?, Real Estate,,,,,,,,
Forex Market Trading Tips, Advisory Services,,,,,,,,
#NAME?, Advisory Services,,,,,,,,
Business management  and human resource management., Loan,,,,,,,,
Bank suggestions!, Banking,,,,,,,,
Bank list, Banking,,,,,,,,
Icbpo, Banking,,,,,,,,
New, Banking,,,,,,,,
Hi i'm New Here , Banking,,,,,,,,
Hello everyone, Banking,,,,,,,,
I live in Dubai and want to take a car loan from a bank or a financial institution..., Loan,,,,,,,,
Negative Beliefs About Money - How To Uncover And Eliminate Wealth Blocks, Advisory Services,,,,,,,,
Has anyone taken out a payday loan online?, Loan,,,,,,,,
Tricks to Raise Credit Scores - The Truth About Increasing Your Credit Score & the Op, Banking,,,,,,,,
Credit Card in collections, Credit Card,,,,,,,,
credit card(cash advance), Credit Card,,,,,,,,
retirement, Retirement Plan,,,,,,,,
TDS on contract of supplying doctors., Banking,,,,,,,,
Gst, Banking,,,,,,,,
What kind of amenities do residences in dubai offer? Any idea?, Loan,,,,,,,,
How to start a business in USA for non resident?, Loan,,,,,,,,
Easy tips for sell a home very fast, Loan,,,,,,,,
Investing in Phuket Real Estate, Real Estate,,,,,,,,
Best way to save battery on Android, Advisory Services,,,,,,,,
Best Game Service For yo , Banking,,,,,,,,
In House Lender looking for new ISOs, Banking,,,,,,,,
Direct Deposit, Banking,,,,,,,,
What percentage of Americans bank on-line ?, Banking,,,,,,,,
BIS-locational statistics calculation, Banking,,,,,,,,
greetings to everyone., Banking,,,,,,,,
Hallo! I'm New and eager to learn , Banking,,,,,,,,
Warm Hi and Hello, Banking,,,,,,,,
I heve no FCA licence, can i get affiliate service in UK?, Banking,,,,,,,
Payday loans... useful?, Loan,,,,,,,,
Simple Interest Calculation on Bank Loan, Banking,,,,,,,,
Delete Credit, Credit Card,,,,,,,,
Credit Card from England, Credit Card,,,,,,,,
Don't understand question??? , Banking,,,,,,,,
Can someone please help me understand how economy and currency works ?, Banking,,,,,,,,
long and confusing question..., Banking,,,,,,,,
AvivaUSA remains stronger than EVER!, Banking,,,,,,,,
(((+91-8107216603))) intercast___love marriage solution baba ji, Banking,,,,,,,,
I want to invest in Dubai's residential market. , Advisory Services,,,,,,,,
Everyone has been talking about the Toyota Yaris smart spacing feature. What is about, Banking,,,,,,,,
I have heard about Kaya's Derma Stemness Face Therapy. What is it all about? , Banking,,,,,,,,
Buy Driver's License, Passport,   ((whatsapp +237679499813))) , Banking,,,,,,
STOCK MARKET IS COMPROMISE!!! Part 2 Airline Industry, Advisory Services,,,,,,,,
Stock market is compromise!!! Please read, Advisory Services,,,,,,,,
Business Loans, LOCs, Trucking, Oil and Gas, Real Estate Investments and much more, Loan,,,,
Depositing Cashier's Check , Banking,,,,,,,,
What is \u201cbrick-and-mortar\u201d traditional banking service?, Banking,,,,,,,,
hello, everyone, Banking,,,,,,,
New to forum, Banking,,,,,,,,
Hi, Everyone!, Banking,,,,,,,
Hello, Banking,,,,,,,,
Long Term Loans Online - No Credit History .., Loan,,,,,,,,
1500 payday loan, Loan,,,,,,,,
Credit / Debit Card saving service, Banking,,,,,,,,
question about credit cards, Credit Card,,,,,,,,
When does Interest Start on a CC?, Banking,,,,,,,,
present value of annuity 5 years from now. please help!!, Banking,,,,,,,,
Repaying debt and find number of months problem. Please help!, Advisory Services,,,,,,,,
Investnment Question 2, Banking,,,,,,,,
The Financial Power Hour, Advisory Services,,,,,,,,
Fourth Quarter Index Annuity Sales Sharply Up, Banking,,,,,,,,
Who sells what?, Banking,,,,,,,,
best ######+91-8107216603 love problem solution specialist baba ji, Advisory Services,,,,,,,,
Love______Spell+91-8107216603 Voodoo Doll Specialist baba ji in Australiya, Banking,,,,,,,,
((love Spell))____+91-8107216603 intercast Love Marriage Solution Specialist baba ji, Banking,,,,,,,,
Eid Al-Adha, Banking,,,,,,,,
Suggest best startegy or ideas for business growth., Banking,,,,,,,,
How to manage urine incontinence during travel?, Banking,,,,,,,,
Apply For Business and Personal Loan Offer 2% (E-mail us on infsllp@yandex.com), Loan,,,,,,,,
Compare Home Equity and Mortgage loans, Loan,,,,,,,,
I want to partners start my own auto manufacturing unit in Saudi Arabia., Loan,,,,,,,,
Introduction, Banking,,,,,,,,
hi :), Banking,,,,,,,,
My intro, Banking,,,,,,,,
Which card to pay off?, Banking,,,,,,,,
Is closing a credit card account a huge mistake?, Credit Card,,,,,,,,
Investment Question 1, Banking,,,,,,,,
Apr, Banking,,,,,,,,
Treasury, Banking,,,,,,,,
Financial Services/Insurance Cults, Loan,,,,,,,,
Car Insurance, Insurance,,,,,,,,
An Insurance Change We Do NOT Need, Insurance,,,,,,,,
Are Fixed Indexed Annuities SAFE?, Banking,,,,,,,,
bEsT/////no.1/////+91-8107216603// black magic Specialist baba ji, Banking,,,,,,,,
dfgdsfgh, Banking,,,,,,,,
What are the different types of expenditures considered for the purpose of accounting, Advisory Services,,,,,,,,
I am interested in buying the Previa but want to know of the safety features as it is, Investment,,,,,,,,
How to treat incontinence?, Banking,,,,,,,,
What major caused medical science highlight about incontinence?, Banking,,,,,,,,
Can you suggest some companies in Saudi Arabia that are involved in multiple business, Banking,,,,,,,,
Where can i find a company engaged in philanthropic work in Saudi Arabia?, Loan,,,,,,,,
.Buy driving license,id cards,passports (diplomaticdocsassistance@yahoo.co.uk)certifi, Banking,,,,,,
Hi to all finance experts out there :), Advisory Services,,,,,,,,
What a good dissertation topic from these?!, Banking,,,,,,,,
Help needed!, Advisory Services,,,,,,,,
Finance Question, Advisory Services,,,,,,,,
Creating cash flows, Banking,,,,,,,,
Boring is exciting!, Banking,,,,,,,,
During a Recession insurance savings is the first place to start, Banking,,,,,,,,
Just limping along at 5%., Banking,,,,,,,,
How to fix Error 3371, Status code -11118 ?, Banking,,,,,,,
Can a student get debit card?, Banking,,,,,,,,
Best Joke Service Ever, Banking,,,,,,,,
I want to consider some good options in beds for my kids. Where can I check some..., Loan,,,,,,,,
Is incontinence common among young or old?, Advisory Services,,,,,,,,
I have many skin allergies and one of them is on the face, where I have red pus fille, Banking,,,,,,,
Working back in a lattice for CoCo-bonds, Banking,,,,,,,,
Urgent!!!3 questions about Treasury and Agency Securities, Banking,,,,,,,,
Which is the best investment book you ever read and why ?, Banking,,,,,,,,
Homework Assistance, Banking,,,,,,,,
Variable Annuity vs Fixed Annuity, Banking,,,,,,,,
Thinking about getting life insurance?, Insurance,,,,,,,,
What is the benefit of currency card?, Banking,,,,,,,,
What are the things to be ensured while making an investment?, Banking,,,,,,,,
Buy Passport,Visa,Driving License,ID CARDS,marriage certificates,Green cards etc, Banking,,,
I wish to buy some quality and designer fabrics for my clothing. Any recommendations?, Banking,,,,,,,,
I am working on the interiors of a study room and need help with wall shelves., Banking,,,,,,,,
Which brand in Saudi is well known for incontinence products?, Banking,,,,,,,,
Rent or buy a first property for a Stock Investor?, Advisory Services,,,,,,,,
First Time Home Buyer--Need Advise, Loan,,,,,,,,
Annuity every other year Q- plz help, Banking,,,,,,,,
Real options Analysis, Loan,,,,,,,,
Traditional Fixed Annuites and FIXED Indexed Annuities, Banking,,,,,,,,
Renters Insurance in Florida, Insurance,,,,,,,,
Why protect your money with a FIXED Annuity?, Advisory Services,,,,,,,,
What to do with 70k, Banking,,,,,,,,
color mixture machine | interlocking tiles chemicals, Banking,,,,,,,,
How QuickBooks Support helps Users to Access company file on Cloud servers, Loan,,,,,,,,
Should I Invest in Bitcoin?, Advisory Services,,,,,,,,
What\u2019s special about Bitcoin?, Banking,,,,,,,,
Guidance for Novice Traders, Banking,,,,,,,,
New Year\u2019s Resolutions: What Stocks to Buy for 20107, Banking,,,,,,,,
Next plan of attack?, Banking,,,,,,,,
Advice on which way to go, Advisory Services,,,,,,,,
What Should I do?, Banking,,,,,,,,
Credit Rating tips, Banking,,,,,,,,
non-custodial parental insurance responsibilites, Insurance,,,,,,,,
What is a Life Insurance Trust?, Insurance,,,,,,,,
Best Career Service Ever, Banking,,,,,,,,
Best Careers Service Ever, Banking,,,,,,,,
Virtual Income is a Scam ! Do not invest !, Advisory Services,,,,,,,,
Swing or day trading systems?, Banking,,,,,,,,
Refinance equation?, Banking,,,,,,,,
Marriage, Mortgages, and Foreclosure, Banking,,,,,,
Collection on credit report, Banking,,,,,,,,
Savings and credit rating, Banking,,,,,,,,
What's the Plan? , Banking,,,,,,,,
Guide To Fixed Annuities, Banking,,,,,,,,
Do Insurance compainies pay for studies to make them come out top?, Banking,,,,,,,,
Court Loss of Earnings returning to Employeer, Banking,,,,,,,,
Use technology to advance your Forex career - trading CFDs, Banking,,,,,,,,
Stock market is compromise!!! Please read, Advisory Services,,,,,,,,
Doing intraday trading\u2026, Banking,,,,,,,,
looking for the best investments, Banking,,,,,,,,
Forecloser if late on 2nd mortgage?, Mortgage,,,,,,,,
Will I be able to get a refinancing?, Banking,,,,,,,,
Excellent article about potential pitfalls applying for a loan modification, Loan,,,,,,,,
Duration Weighted Spread ??, Banking,,,,,,,,
How can I better my rating?, Banking,,,,,,,,
Zurich ZIO Savings Scheme Isle of Man, Banking,,,,,,,,
20%+ ROI for the last 6 to 7 years, Banking,,,,,,,,
lender is asking for \xa310,000 more to redeem a legal charge than i owe!, Banking,,,,,,,
Reduce credit limit to get mortgage?, Banking,,,,,,,,
Want to be a Guest on a Live NYC Talk Show?, Banking,,,,,,,,
Will this work to get out of debt?, Advisory Services,,,,,,,,
Why bitcoin is good option for an investment?, Banking,,,,,,,,
Mobile Binary Code Binary Scam Review, Banking,,,,,,,,
mortgage calculators?, Mortgage,,,,,,,,
Need to refinance, where do I start?, Loan,,,,,,,
Unique situation - any ideas?, Banking,,,,,,,,
Pre-Retirement Annuity W/D tax rate?, Loan,,,,,,,,
Keep money in savings or in Personal Loan?, Loan,,,,,,,,
Need advice on consolidation and my thoughts on Chase, Advisory Services,,,,,,,,
What should I do with this car?, Loan,,,,,,,,
Get your latest iPhone for your commitment from FBS!, Banking,,,,,,,,
Advice on how to compare funds, Advisory Services,,,,,,,,
Online Forex Trading is Made Simple and Reliable with OctaFX, Banking,,,,,,,,
paying off a car loan to get a better interest rate, Loan,,,,,,,,
I need expert advice- please, Advisory Services,,,,,,,,
When to start planning for retirement?, Retirement Plan,,,,,,,,
Escaping to paradise, Banking,,,,,,,,
C.O.L.A. vs Investments, Banking,,,,,,,,
Critique this plan to abolish my debt., Advisory Services,,,,,,,,
SOL Question, Banking,,,,,,,,
Considering bankruptcy... Financial questions needed answering..., Advisory Services,,,,,,,,
Best promotion of 2016! Only from Forex Broker FBS!, Banking,,,,,,,,
Stock market is compromise!!! Please read, Advisory Services,,,,,,,,
Delinquency Help, Banking,,,,,,,,
Son Helping Father Refinance. Need Advice Badly, Advisory Services,,,,,,,,
Mortgage Interest, Banking,,,,,,,,
Effective Strategic Business Plans, Banking,,,,,,,,
Consolidation of 401K - Please Advice, Advisory Services,,,,,,,,
Advisor not wanting to do 'B' shares , Advisory Services,,,,,,,,
LPL wrap account, Banking,,,,,,,,
Required Home Loan, Loan,,,,,,,,
clydesdale bank, Banking,,,,,,,,
In over our heads, Banking,,,,,,,,
The Credit Score RED HERRING, Banking,,,,,,,,
Terrible Mistake?, Banking,,,,,,,,
Forex Strategy (NZD/CHF), Banking,,,,,,,,
help!! my ex is planning to force forclosure, Banking,,,,,,,,
\xc9change / vente Transcash, Neosurf, PCS coupon / bon, Paysafecard, NeoCode, Amazon, B, Banking,,
Expanded polystyrene pakistan | insulation panels pakistan, Banking,,,,,,,,
Exchange / Sell Transcash, Neosurf, PCS coupon/voucher, Paysafecard, NeoCode, Amazon,, Banking,,
Inheritance advice needed (if you are willing)..., Advisory Services,,,,,,,,
Need advice on which savings vehicle to use, Banking,,,,,,,,
Should I Increase My 401K Contribution At This Time?, Banking,,,,,,,,
Types of business, Loan,,,,,,,,
How to choose Bank for personal loan, Loan,,,,,,,,
How about Bridging Loans?, Loan,,,,,,,,
What do you look for in a bank?, Banking,,,,,,,,
Info regd Banks Treasury Department, Banking,,,,,,,,
Which financial institutions are safe now?, Advisory Services,,,,,,,,
I got my Default REMOVED!! but need advice, Advisory Services,,,,,,,,
Credit Card Debt, Banking,,,,,,,,
Too much can't pay everyone must choose , Advisory Services,,,,,,,,
Hi Everyone!, Banking,,,,,,,,
CC monitoring your behaviour, Banking,,,,,,,,
Donald Trump WINS the US Presidential Election!, Banking,,,,,,,,
Acquisition Financing, Banking,,,,,,,,
Financial bank instruments for Lease and sale for trade and project finance., Banking,,,,,,,,
Withdraw from 401k for mortgage, Mortgage,,,,,,,,
American Funds Simple IRA, Banking,,,,,,,,
Which points are important, when we are planning for retirement?, Retirement Plan,,,,,,,
Personal Loan, Loan,,,,,,,,
New business venture and having trouble getting funded, Loan,,,,,,,,
hard money loans??, Advisory Services,,,,,,,,
Personal Loans Available!, Loan,,,,,,,,
HSBC commissions question, Banking,,,,,,,,
Check Clearing Concern, Banking,,,,,,,,
Bank NFS Fees APRS, Banking,,,,,,,,
Help with consolidation, Banking,,,,,,,,
Ideas for high paying hard work to pay off debt, Advisory Services,,,,,,,,
Drowned in debts, Banking,,,,,,,,
hello to everyone, Banking,,,,,,,,
Noob, Banking,,,,,,,,
REVEALED: My Million-Dollar Mistake You Don't Want to Make! , Banking,,,,,,,,
Work Expenses/Personal Credit Card/Issues, Banking,,,,,,,,
Pre-paid Credit Cards, Credit Card,,,,,,,,
How to use credit card, Credit Card,,,,,,,,
Introduction to Purpose-Built Insurance, Insurance,,,,,,,,
How to find a good broker?, Banking,,,,,,,,
Acquista Passaporto, Patente, carta d'identit\xe0, IELTS, TOEFL, e.t.c , Banking,,,
most everyones financial future looks bad, Advisory Services,,,,,,,,
Traditional or Roth IRA?, Banking,,,,,,,,
Too early to start saving?, Loan,,,,,,,,
Need Help Understanding Terms / Concept / Consequences, Banking,,,,,,,,
Secured Loan. Why? When? How?, Loan,,,,,,,,
Tax-related question for parent-child loan, Loan,,,,,,,,
Looking for short term loan, Loan,,,,,,,,
Irr, Banking,,,,,,,,
Closing accounts 0 balance, Banking,,,,,,,,
Withdrawl money without authorization?, Advisory Services,,,,,,,,
Out of control students loans, Loan,,,,,,,,
Paying off my student loans with a home equity line?, Loan,,,,,,,,
Newbie alert, Banking,,,,,,,,
Newbe Here, Banking,,,,,,,,
Hi All from E Q, Banking,,,,,,,,
Hi, Banking,,,,,,,,
How is urine leakage linked to age?, Advisory Services,,,,,,,,
I learned my lesson, Banking,,,,,,,,
Can I still improve my credit?, Banking,,,,,,,,
I destroyed my credit in one year....at 22 years old, Credit Card,,,,,,,,
,BUY IELTS,DIPLOMAS,TOEFL,TOEIC,DL,ID,SSN/SSC ( picoloperes@gmail.com )Passport,Birth, Loan
Book Keeping software, Banking,,,,,,,,
Urgent loan offer at 3% interest rate, Loan,,,,,,,,
401K - Should I stay or should I go?, Banking,,,,,,,,
Two traditional IRAs?, Banking,,,,,,,,
Self-Directed IRAs, Banking,,,,,,,,
Buy real euro,dollar and other currencies(uniqueproducers@yandex.com), Loan,,,,,,,
Can you suggest some good car dealers in Saudi Arabia?, Loan,,,,,,,,
Realestate, Banking,,,,,,,,
need loan will to pay high intrest, Loan,,,,,,,,
Personal Loan, Loan,,,,,,,,
Home Equity Line of Credit..., Loan,,,,,,,,
world bank, Banking,,,,,,,,
TT of Funds to another Bank..., Banking,,,,,,,,
British banks to reveal impact of credit squeeze, Banking,,,,,,,,
Onnline Banking, Banking,,,,,,,,
Hi All, Banking,,,,,,,,
WEBINAR-NOV 21ST 11:00 AM Eastern Time, Banking,,,,,,,,
Hi All, Banking,,,,,,,,
I can't find a good night cream. Please suggest. , Banking,,,,,,,,
I am tempted to get laser hair removal done but I m scared of the side effects. Pleas, Banking,,,,,,,,
I am looking at buying new light fittings for my new home in UAE and wish to see some, Banking,,,,,,,,
Advice on joint credit card to raise credit, Credit Card,,,,,,,,
Customized card stickers - where to buy online?, Banking,,,,,,,,
American Express Penalties??, Banking,,,,,,,,
Axis Planning & Consulting Corporate Performance Management Solutions, Banking,,,,,,,,
How to preserve your wealth in these uncertain times, Banking,,,,,,,,
What one can learn from the online finance courses, Advisory Services,,,,,,,,
Conversion was done instead of Recharactarization, Banking,,,,,,,,
current business environment, Loan,,,,,,,,
Town Home, Loan,,,,,,,,
Top Tips for Being Successful in Becoming a Real Estate Agent, Real Estate,,,,,,,,
Best tips on clients Management and negotiation, Advisory Services,,,,,,,,
Business Loan., Loan,,,,,,,,
keepingahome, Banking,,,,,,,,
Paying for college, Banking,,,,,,,,
interest rate, Banking,,,,,,,,
Service Charges for receiving NEFT transfer, Banking,,,,,,,,
Similar name, different banks?, Banking,,,,,,,
New Faces in Charlotte, NC, Banking,,,,,,,
Hi Everyone!, Banking,,,,,,,,
Hello Everyone!, Banking,,,,,,,,
Where can I find some options in carry bags? I wish to buy a few for daily grocery, Banking,,,,,,,,
I am interested in buying an apartment in dubai. Which locations shall I start with?, Banking,,,,,,,,
I work long hours and due to which I have dark circles. Can the condition be reversed, Advisory Services,,,,,,,,
Wife's Credit card dept caused by Ex husband , Credit Card,,,,,,,,
Accidentally destroyed my credit card, Credit Card,,,,,,,,
Credit cards. Good, bad, ugly., Banking,,,,,,
Buy Authentic Counterfeit Banknotes(currencyproducers@gmail.com), Loan,,,,,,,,
Exchange Amazon Gift cards, Neosurf, PCS coupon/voucher, Paysafecard, NeoCode, Trans, Banking,,,
Home Loan, Loan,,,,,,,,
How pass the CAPM take it?, Loan,,,,,,,,
looking for a way, Advisory Services,,,,,,,,
Forward-Futures Questions, Banking,,,,,,,,
Great Suggestions On Becoming Successful In Commercial Real Estate, Real Estate,,,,,,,,
How to invest in real estate, Real Estate,,,,,,,,
Has anyone rented Paris apt from one of the below?, Banking,,,,,,,,
Loan offer from private lenders., Loan,,,,,,,,
mortgage down payment, Banking,,,,,,,,
Beware withholdings by US banks under HIRE, Banking,,,,,,,,
Having wages paid into someone else's account , Banking,,,,,,,,
T/T to malasia, help needed, Advisory Services,,,,,,,
Introduction, Banking,,,,,,,,
Introduction, Banking,,,,,,,,
Hello friends, Banking,,,,,,,,
Free Gifts for participation? hope i win, Banking,,,,,,,,
Good days and mage, Banking,,,,,,,,
Obtain passport driver license and id card email.. tonmaek22@yahoo.com, Advisory Services,,,,,,,,
Watch your statements!, Banking,,,,,,,,
advice for best secured credit card, Credit Card,,,,,,,,
How many credit cards do you have in your wallet?, Credit Card,,,,,,,,
How we do Compare Online Share Brokers?, Advisory Services,,,,,,,,
Funds Transfer, Banking,,,,,,,,
Kiplinger - Timely - Trusted - Personal Financial Advice, Advisory Services,,,,,,,,
SML versus regression, Banking,,,,,,,,
Implied Volatility of puts/calls., Banking,,,,,,,,
The Basics of a small business, Loan,,,,,,,,
Real Estate Valuations Services?, Real Estate,,,,,,,,
Selling & Buying New Construction without downpayment, Banking,,,,,,,,
Prefered Investing areas?, Real Estate,,,,,,,,
Debt consolidation UK, Advisory Services,,,,,,,,
Hi from California!, Banking,,,,,,,,
Newbie here, Banking,,,,,,,,
Hello!, Banking,,,,,,,,
QuickBooks Support USA Service Number +1-800-477-8031, Banking,,,,,,,,
Warts are painful and I have three of them. What can I do?, Advisory Services,,,,,,,,
My mother is obsessed about her wrinkles and crow's feet. , Banking,,,,,,,,
Credit Card/Maestro - Help Needed, Credit Card,,,,,,,,
Credit Cardholders Bill of Rights of 2009, Banking,,,,,,,,
Credit Card Debt Help - Golden Rules For Using Credit Cards and How to Get Rid debts, Credit Card,,,,,,,,
Financial Offer/Business Funding Through Bank Instruments, Banking,,,,,,,,
Hsbc bank account in Hong Kong, Banking,,,,,,,,
Which are the best banking solutions for students pursuing higher studies?, Banking,,,,,,,,
How is interest credited?, Banking,,,,,,,,
Fixed Annuities have one (1) negative feature, Banking,,,,,,,,
Shameless plug!, Banking,,,,,,,,
Islamic banking!, Banking,,,,,,,,
Need help asap!!!!!!! Please!!!, Banking,,,,,,,,
Need help with a problem any help with be appericated, Advisory Services,,,,,,,,
Housing Loan Singapore, Loan,,,,,,,,
Westhill Property Consulting, Loan,,,,,,,,
How to find best property sellers in chennai?, Loan,,,,,,,,
I want to start making my baby sleep in a separate cot. What kind should I get., Loan,,,,,,,,
I have little storage space in my bedroom. How can best can I store my linen?, Banking,,,,,,,,
I want to buy my 2 year old some educational toys. Where can I get something good?, Banking,,,,,,,,
lean Up Your Credit - Three Easy Things You Can Do Now, Banking,,,,,,,,
Can I withdraw funds from a fixed deposit account?, Banking,,,,,,,,
Error while sending Accountants Copy, Advisory Services,,,,,,,,
What the different types of bank memberships?, Banking,,,,,,,,
How can you be financially free ?, Banking,,,,,,,,
trying to get a house loan, Loan,,,,,,,,
Exempt assets from spend down..., Banking,,,,,,,,
#1 Rated Financial Workshop In Arizona, Advisory Services,,,,,,,,
Group Health Insurance Plan, Insurance,,,,,,,,
International Diversification, Banking,,,,,,,,
Calculating fixed and variable cost to work out semi variable cost, Advisory Services,,,,,,,,
debt in the Euromarket... Please..., Advisory Services,,,,,,,,
Buy a Home in Phuket Thailand, Loan,,,,,,,,
UK estate agents, Real Estate,,,,,,,,
low cost estate agents, Real Estate,,,,,,,,
I want to do up the kids room in my house. Give ideas., Banking,,,,,,,,
I want to buy a good sleeping bag for my baby to sleep in while I travel., Banking,,,,,,,,
What are the basics of accounting?, Banking,,,,,,,,
Are personal loans offered on reducing balance interest?, Loan,,,,,,,,
Which bank has the fastest process for home loan?, Loan,,,,,,,,
What term in housing loan is ideal?, Loan,,,,,,,,
What type of broker is best for us?, Banking,,,,,,,,
Provides Access To A High Loan Amount, Loan,,,,,,,,
Looking for reliable partner for partnership in the Asia, Banking,,,,,,,,
Do we go for it now, or wait a bit longer?, Advisory Services,,,,,,,
loans for multiple residences - long term?, Loan,,,,,,,,
First time home buyer also need advice, Loan,,,,,,,,
What about any other insurance than auto ?, Loan,,,,,,,,
benefits of cobra insurance, Insurance,,,,,,,,
Health insurance - Top things to know, Insurance,,,,,,,,
Binomial Option pricing question, Banking,,,,,,,,
Black Scholes - Pls help, Banking,,,,,,,,
Idea for a potential merge/acquisition, Banking,,,,,,,,
The importance of having your lender and agent work as a TEAM!, Real Estate,,,,,,,,
How to transfer credit from Etisalat to DU?, Banking,,,,,,,,
Which is the best banking product for investment?, Banking,,,,,,,,
What is auto takaful?, Loan,,,,,,,,
Can banks directly provide car insurance?, Loan,,,,,,,,
Business start-ups, Loans, Project funding, Trade finance via BGs/SBLCs/LCs., Loan,,,,,
Is ICE9 Technology a Scam or a Profitable System?, Financial Scam,,,,,,,,
Financial bank instruments for Lease and sale for trade and project finance., Banking,,,,,,,,
Trying to get a mortgage., Mortgage,,,,,,,,
Refinance Question..., Banking,,,,,,,,
Medical insurance, Insurance,,,,,,,,
Benefits of Cash Value Life Insurance, Insurance,,,,,,,,
Texas Car Insurance, Insurance,,,,,,,,
Required assistance on my assignment, Banking,,,,,,,,
Cost of debt question - Help!!, Advisory Services,,,,,,,,
Phi(Golden Ratio) and stock market price movements, Advisory Services,,,,,,,,
Which bank provides the best financial solution?, Banking,,,,,,,,
Can term deposits be tailored to our need?, Banking,,,,,,,,
What kind of renewable energy forms are being developed in the KSA?, Investment,,,,,,,,
Amibroker with LiveTrade System, Banking,,,,,,,,
The Advantages of Trading Forex are Obvious, Banking,,,,,,,,
How we do Online Trading?, Banking,,,,,,,,
Morgage question.., Banking,,,,,,,,
Pay off which?, Advisory Services,,,,,,,,
Lease vs Buy-chapter 7, Banking,,,,,,,,
