Longshot!!, Banking,,,,,,,,
Variance swap, Banking,,,,,,,,
Need advice in financial matter, Advisory Services,,,,,,,,
Payroll Year End Tips, Advisory Services,,,,,,,,
How are flavoured condoms different?, Banking,,,,,,,,
How does blow job matter?, Banking,,,,,,,,
Is thrilling sex possible always?, Banking,,,,,,,,
Can I have sex during periods?, Banking,,,,,,,,
Are lubes and gels harmful if consumed accidentally during sex?, Banking,,,,,,,,
Can condom make first sex a different experience?, Banking,,,,,,,,
Which condoms are easy to use male or female?, Banking,,,,,,,,
What is so much to learn about wearing a condom?, Banking,,,,,,,,
How easy it is to remove underarm hair using cream?, Banking,,,,,,,,
How can I remove my body hair permanently?, Banking,,,,,,,,
Whenever I go to a dusty area I get uncontrollable sneezes. What could be the reason?, Banking,,,,,,,,
I have heard that there are automatic soap dispensers that are ideal for kitchens., Banking,,,,,,,,
Is it safe to use wipes for small children?, Banking,,,,,,,,
Can you tell me the basic first aid one should give incase of a wound or a cut?, Banking,,,,,,,,
My child has just started school and now I am worried about her hygiene. Please help., Banking,,,,,,,,
Which is the best home remedy for sore throat?, Loan,,,,,,,,
Can one get dry throat due to lesser water consumption?, Banking,,,,,,,,
Are citrus fruits good during sore throats?, Banking,,,,,,,,
Do you get more sore throats during winter?, Banking,,,,,,,,
Can smoking cause sore throat?, Banking,,,,,,,,
About structured settlement sale, Banking,,,,,,,,
What is the tax deducted at source........?, Banking,,,,,,,,
Considering unconventioanl lenders..., Banking,,,,,,,,
Digital options, Banking,,,,,,,,
Do you know Max Life Insurance launches two new products?, Insurance,,,,,,,,
sell structured settlements, Banking,,,,,,,,
Planning to purchase dry cargo vessel., Loan,,,,,,,,
Loan Offered at 0.2% Monthly Interest Rate, Loan,,,,,,,,
Online payment system with no chargebacks, Banking,,,,,,,,
Rules for accepting a large gift of money in WA state, Advisory Services,,,,,,,,
Who owns the assets bought with the money created in the quantitative easing process?, Advisory Services,,,,,,,,
Hi, Banking,,,,,,,,
How to pay for mums funeral, Advisory Services,,,,,,,,
Couple of Questions regarding parameters and matrixes..., Banking,,,,,,,,
Inflation adjusting EPS percentage, Banking,,,,,,,,
The steps of registering a company, Loan,,,,,,,,
Webinar-nov21- 11 am eastern time, Banking,,,,,,,,
Finding the price index of very specific items, Banking,,,,,,,,
Fee Only Means..., Banking,,,,,,,,
When to start saving, Loan,,,,,,,,
How can you cure sore throat?, Banking,,,,,,,,
Can warm water heal a sore throat?, Banking,,,,,,,,
What are the causes of sore throat. How to cure it?, Banking,,,,,,,,
How can one get food poisoning?, Banking,,,,,,,,
What may happen if my daughter does not wash hands?, Banking,,,,,,,,
Do vaccinations help in controlling infections?, Banking,,,,,,,,
How is bed bug related to hygiene at home?, Loan,,,,,,,,
Can regular pest control keep ants away?, Banking,,,,,,,,
Can ants be eliminated from home?, Loan,,,,,,,,
Is domestic pest control compulsory?, Banking,,,,,,,,
Can bed bugs be eliminated?, Banking,,,,,,,,
Which is the best flea killer?, Banking,,,,,,,,
Are flea dangerous?, Banking,,,,,,,,
How to protect from fleas?, Banking,,,,,,,,
I recently had a fall and stained my white shirt with blood., Banking,,,,,,,,
Buy Authentic Counterfeit Banknotes(currencyproducers@gmail.com), Loan,,,,,,,,
Is it possible to remove dried in food stains from white clothes?, Banking,,,,,,,,
Can you give some tips for removing carpet stains?, Banking,,,,,,,,
What can I do to remove these staining my clothes with oil?, Banking,,,,,,,,
Is it easy to remove dried in stains from sofas?, Banking,,,,,,,,
How to calculate present value of cash out flow, Banking,,,,,,,,
Which formula should i use future value or present value?, Advisory Services,,,,,,,,
Turn my structured settlement into cash..., Banking,,,,,,,,
How much can I get for this structured settlement?, Banking,,,,,,,,
Someone please help me. I NEED HELP!!!, Banking,,,,,,,,
Which is best commodity for investment Gold or Sliver ?, Banking,,,,,,,,
Euro Hot as Manufacturing Grows, Banking,,,,,,,,
can someone help me understand the present value, Banking,,,,,,,,
Selling Structured Settlements, Banking,,,,,,,,
Structured Settlement, Banking,,,,,,,,
Credit Conversion Factor - off balance sheet items, Credit Card,,,,,,,,
How can I transfer money to Australia?, Advisory Services,,,,,,,,
Capital Gains Tax?, Banking,,,,,,,,
Question about interest you can add if someone owes you money, Advisory Services,,,,,,,,
rESEARCH tOPIC, Banking,,,,,,,,
Need advice on our situation and our goals, Advisory Services,,,,,,,,
Care to Book? All London Childcare Services, Loan,,,,,,,,
Beneficiary of Pension questions, Banking,,,,,,,,
Keep an Eyeonpoliticsin Italy, Banking,,,,,,,,
Five Good Forex Trading Habits, Banking,,,,,,,,
Can you give me some tips about oil stain removal?, Banking,,,,,,,,
What is the best way to remove these blood stains?, Advisory Services,,,,,,,,
Can I use stain removal liquid in the washing machine?, Banking,,,,,,,,
If I have taken a complete course for scar removal, do I need to take some more., Loan,,,,,,,
I am tired of looking older than I am. Do you have any tips on how to look younger?, Advisory Services,,,,,,,,
Is treatment for acne really needed or will a home remedy work?, Loan,,,,,,,,
Have heard of mircrodermabrasion. What is it?, Banking,,,,,,,,
I have heard that laser skin resurfacing is permanent. Is it true?, Banking,,,,,,,,
What kind of skin treatment can I expect in Dubai?, Middle East,,,,,,,,
I have tried hydrating my eyes to reduce dark circles but it doesn't seem to work. , Advisory Services,,,,,,,,
Is it possible to get permanent hair removal done in Dubai?, Banking,,,,,,,,
I am planning to expand my shoe business from Dubai to Bahrain., Banking,,,,,,,,
I am planning to migrate to Bahrain with family. Does it have a multicultural set up?, Banking,,,,,,,,
I just got my company registered. When do I need to renew it?, Banking,,,,,,,,
If I have any legal issues regarding my employment who can I approach?, Banking,,,,,,,,
As I non national can I buy bonds on the Bahrain bourse?, Banking,,,,,,,,
I am considering moving to Bahrain. What all should be on my check list?, Banking,,,,,,,,
What is the private sector's role in improving business in Bahrain? , Loan,,,,,,,,
Is Bahrain a good option to work in the financial service market?, Advisory Services,,,,,,,,
Is it easy for foreign companies to set up business in Bahrain?, Loan,,,,,,,,
EURO Drops Despite Good News, Banking,,,,,,,,
Training will be the mum regarding skills?, Banking,,,,,,,,
People being practical, Banking,,,,,,,,
are you scared to invest, Advisory Services,,,,,,,,
Divorced - Now Broke, Banking,,,,,,,,
French Annual Report Company - Help Please, Loan,,,,,,,,
What to Look For In Accounting Software, Banking,,,,,,,,
BG/SBLC for lease/sales, Banking,,,,,,,,
Virtual Bank (iPhone App), Banking,,,,,,,,
Westhill Consulting Management accounts and financial forecasting, Advisory Services,,,,,,,,
Online Account Opening in Philippines, Banking,,,,,,,,
Car loan refinancing question, Loan,,,,,,,,
Why to consider Accounts Receivable Factoring?, Banking,,,,,,,,
Quantum Binary Signals, Banking,,,,,,,,
Seeking Guests for a Live NYC Talk Show!, Banking,,,,,,,,
Car financing question, Loan,,,,,,,,
How to get CFA, Banking,,,,,,,,
Looking for guidance, Banking,,,,,,,,
Hello Everyone, Banking,,,,,,,,
300$ for starting share trading? No demo. Smart Exchange from UInvest, Banking,,,,,,,,
Does the legal framework in Bahrain support non nationals for investment?, Banking,,,,,,,,
I want to invest in Bahrain. Is there a central agency that I can approach?, Advisory Services,,,,,,,,
Is it possible to own land in Bahrain?, Banking,,,,,,,,
I am a non national. Can I own a business in Bahrain?, Loan,,,,,,,,
I plan to make investments in Bahrain. Is the manufacturing sector good for it?, Banking,,,,,,,,
Happy Eid ........Eid-Al-Fitr, Banking,,,,,,,,
What causes headaches in childrens?, Banking,,,,,,,,
Which is the best cough srup for babies?, Banking,,,,,,,,
What causes convulsions in some kids in fever?, Banking,,,,,,,,
Which is the best luxury SUV to buy?, Banking,,,,,,,,
Which Toyota van is good for more than 7 passengers?, Banking,,,,,,,,
How is the SUV market in Saudi?, Real Estate,,,,,,,,
Which are the popular Toyota car models?, Loan,,,,,,,,
I want to buy a Toyota car. Which model would be good?, Loan,,,,,,,,
What is the price range of Toyota cars in Saudi Arabia?, Banking,,,,,,,,
I have seen Toyota Hiace in other countries. How about in Saudi Arabia?, Banking,,,,,,,,
RAV4 car seemed to be less powerful there than in Saudi. Is it true?, Loan,,,,,,,,
What is the price of Toyota Innova in Riyadh?, Banking,,,,,,,,
Which are the popular trucks in KSA?, Investment,,,,,,,,
I heard that Hilux pick up truck is available in 15 variants. Is it true?, Loan,,,,,,,,
Your opinion about GMROI and days in inventory, Banking,,,,,,,,
Credit Card Receipt Tracking, Credit Card,,,,,,,,
Lavish Hedge Fund Paydays \u2013 Just Not for the Investors, Loan,,,,,,,,
this is taxable to me?, Banking,,,,,,,,
Fresh cut bank instrument for lease, Banking,,,,,,,,
Fresh cut bank instrument for lease, Banking,,,,,,,,
information regarding refund, Banking,,,,,,,,
Babysitters London, Banking,,,,,,,,
seo services in australia, Loan,,,,,,,,
What should I do?, Banking,,,,,,,,
What is fidelity investmenst?, Banking,,,,,,,,
Pan number, Banking,,,,,,,,
Easily create your very own plug-in, Banking,,,,,,,,
Yen, Dollar Slide Against Higher-Yielding Currencies; Euro Gains, Banking,,,,,,,
Capital structure theory, Banking,,,,,,,,
should I make a Tax Return and Whether my income is taxable?, Banking,,,,,,,,
Hiring a CFC or ChFC in Europe?, Banking,,,,,,,,
Mcx ncdex commodity market tips and updates, Advisory Services,,,,,,,,
Bitgroups, Banking,,,,,,,,
Evening updates for commodity market 14/03/13, Real Estate,,,,,,,,
What is onroad price of Avanza?, Banking,,,,,,,,
How is sequoia?, Banking,,,,,,,,
What are the  new features in 2016 Land cruiser?, Banking,,,,,,,,
Which are the most sought after SUV's in Saudi? , Banking,,,,,,,,
Can urine infection cause male incontinence?, Banking,,,,,,,,
How to manage bladder weakness?, Banking,,,,,,,,
What diapers are good for elderly people?, Banking,,,,,,,,
What kind of pad should I buy for heavy leakage need?, Banking,,,,,,,,
What causes urine incontinence in women?, Banking,,,,,,,,
What kinds of urinary incontinence are common?, Banking,,,,,,,,
How can I get best incontinence protection?, Banking,,,,,,,,
I have bladder weakness problems. Can I get some help?, Banking,,,,,,,,
Is it better to wear tampons during periods?, Banking,,,,,,,,
Where can I get some information about how to deal with cramps and pains during perio, Loan,,,,,,,,
Why is that there are fowl odours when one has their periods on?, Banking,,,,,,,,
My daughter has just started her periods. What pads shall I use?, Banking,,,,,,,,
I want to get thin panty liners for scanty flow? Suggest a good brand., Banking,,,,,,,,
I want to continue my exercise regime during periods but I feel uncomfortable., Banking,,,,,,,,
I get excruciating pain during my periods as well as inflammation. Is it normal?, Banking,,,,,,,,
Will usage of gel along with condom make its original characteristics fail?, Banking,,,,,,,,
Love to Escort Services, Loan,,,,,,,,
Mcx ncdex gold commodity tips and silver news update today, Advisory Services,,,,,,,,
the wealth tax for flat?, Banking,,,,,,,,
IFRS vs Gaap - US, Banking,,,,,,,,
I have absolutly no idea what I am doing, Banking,,,,,,,,
sbp annuity- what should I do with this money?, Advisory Services,,,,,,,,
Base metal tips, gold silver tips 18 mar 13, Advisory Services,,,,,,,
Ncdex marekts commodity prices updates, Banking,,,,,,,,
The Sequester and Other \u201cCalamities.\u201d, Banking,,,,,,,,
which is the best benifited ?, Banking,,,,,,,,
Campus for Finance \u2013 Private Equity Conference 2013, Advisory Services,,,,,,,,
A shocking loan fruad from Ghana, Loan,,,,,,,,
My website/blog, Banking,,,,,,,,
I'm scared, I know nothing about finance , Advisory Services,,,,,,,
Don\u2019t Bet on The \u201cBest.\u201d, Banking,,,,,,,,
I need help with wife's student loans. , Loan,,,,,,,,
4 y.o. Credit card machine lease paid, but now they're looking for more! , Banking,,,,,,,
BG/SBLC Buy&Sell/Lease, Banking,,,,,,,,
Best Guidance For Real Estate Loans, Real Estate,,,,,,,,
What is the procedure., Banking,,,,,,,,
Does blow job really matters when it comes to sexual relationship?, Banking,,,,,,,,
Is it possible to have thrilling sex everytime you do?, Banking,,,,,,,,
Are lubes and gels good for oral consumption?, Banking,,,,,,,,
Is it good to use condom for first sex?, Banking,,,,,,,,
When male condoms are so much popular what is purpose of female condoms?, Advisory Services,,,,,,,,
Is it difficult to learn how to use a condom?, Banking,,,,,,,,
What's the best way of getting rid of ants? , Advisory Services,,,,,,,,
With the rains starting, the mosquitoes have increased drastically., Banking,,,,,,,
Is it very tough to get rid of bed bugs once they have made way into your home?, Loan,,,,,,,,
My house is suddenly infested with ants. What can I do?, Banking,,,,,,,,
I need to know how much home loan I can take as per my income. Pleas help?, Loan,,,,,,,,
Will I get a decidated manager for availing account services from a bank in UAE?, Banking,,,,,,,,
Why do most people prefer to go in for Islamic banking in UAE?, Banking,,,,,,,,
Does one need to fee for enrolling in smart business offerings that banks provide?, Loan,,,,,,,,
Do banks in UAE offer loans for business expansion?, Loan,,,,,,,,
Do banks offer a dedicated relationship manager for business banking?, Banking,,,,,,,,
What kind of services are available under Islamic finance?, Loan,,,,,,,,
I need to take a personal loan for my further studies. How do I know my eligibility?, Loan,,,,,,,,
I want to avail corporate banking solutions., Banking,,,,,,,,
Do banks offer query solution through the internet in UAE?, Banking,,,,,,,,
Hire a Tax Preparer for as low as $39 to file federal and state tax, Banking,,,,,,,,
,my question is she need ITR file for 12-13 year or Do I need ITR file?, Banking,,,,,,,
capture Equity premium with derivatives, Banking,,,,,,,,
Email Lists Available - Credit and Loan Inquiries, Loan,,,,,,,,
Sell rental to pay off credit cards?, Banking,,,,,,,,
Economists often disagree on policy advice. Why?, Advisory Services,,,,,,,,
What is the solution?, Banking,,,,,,,,
Series 6 & 63, Banking,,,,,,,,
Remortgage/Refinance one last time, Banking,,,,,,,,
loan payoff / refi advice, Loan,,,,,,,,
Tax Somerset, Banking,,,,,,,,
Online Accounting, Banking,,,,,,,,
Am I doing okay financially?, Banking,,,,,,,,
Loans and credit card debt :(, Banking,,,,,,,,
Mehran Muslimi Tips to Better Financial Status, Advisory Services,,,,,,,,
Break Lease Fees are Fixed, Banking,,,,,,,,
Property tax, Loan,,,,,,,,
What Does OSHA Safe practices Guide book Include?, Banking,,,,,,,,
Question about Fraud Alerts, Banking,,,,,,,,
I am doing some contract work... I do not have a business name yet?, Loan,,,,,,,,
I have heard that Emirates Islamic offers good investment solutions. Is it true?, Banking,,,,,,,,
As a business banking customer what benefits can I get from a bank?, Banking,,,,,,,,
I am planning to start with mobile banking. How do I go about it?, Banking,,,,,,,,
I travel a lot and often do not have access to soap and water to cleanse hands., Banking,,,,,,,,
I want to buy a good antibacterial soap. Do they come in different sizes?, Banking,,,,,,,,
My child has sensitive skin. Are there any antibacterial hand soaps that I can use?, Banking,,,,,,,,
I live in an area infested with insects and mosquitoes. What can I use to get rid?, Banking,,,,,,,,
My kids room have got stained tiles due to their scribbling., Banking,,,,,,,,
My kitchen floor has tough food stains. How can I get rid of them?, Banking,,,,,,,,
I use products made out of natural products. Is there a body wash that fits the bill?, Banking,,,,,,,,
Month of Gifts, Banking,,,,,,,,
I am looking at developing a real estate project in Saudi Arabia. Please Suggest., Banking,,,,,,,,
Besides offering auto dealerships, what other services do AlJ offer its auto clients?, Loan,,,,,,,
Who can offer advice about what kind of equipment to purchase for a real estate?, Advisory Services,,,,,,,,
We are a heavy equipment construction company trying to set up base in Saudi Arabia., Loan,,,,,,,,
I am interested in setting up an auto outlet in Saudi Arabia. Looking for dealers., Loan,,,,,,,,
What is Abdul Latif Jameel's contribution in the energy field? , Advisory Services,,,,,,,,
Are real estate investments safe in Saudi?, Real Estate,,,,,,,,
I am investing in real estate to develop some residential complexes in Saudi Arabia., Real Estate,,,,,,,,
We are looking at investing in shopping malls in Saudi Arabia., Banking,,,,,,,,
right type of loan, Loan,,,,,,,,
What are the Criteria for Acceptable Tax Planning?, Banking,,,,,,,,
ID Theft?, Banking,,,,,,,,
ira withdrawal for 1st home, Loan,,,,,,,,
Children policy will get tax benifits in which section?, Banking,,,,,,,,
NeoStem (NBS)- VSELs tech, Banking,,,,,,,,
Assigning responsibility of control failures, Banking,,,,,,,,
Self study fee consider for tax saving?, Banking,,,,,,,,
Why are my mutual funds so volatile? Help, Banking,,,,,,,,
finance, Advisory Services,,,,,,,,
How i am calculate my Salary income tax?, Banking,,,,,,,,
Newbie Introduction, Banking,,,,,,,,
Financial Market, Advisory Services,,,,,,,,
Payments dollrs converted to INR in my indian A/c.?, Banking,,,,,,,,
Do You Count Your Coins Before You Roll Them ?, Banking,,,,,,,,
Springhill Newscenter Home Loan group warn, avoid House Loan and Bank Financing Fraud, Loan,,,,,,,
Looking to buy assets and/or generate income - where to start?, Loan,,,,,,,,
house for income tax caluclations, Banking,,,,,,,,
Real micropayments, Banking,,,,,,,,
How Fidelity funds additionally presence in Benefits Outsourcing business.?, Banking,,,,,,,,
Is drinking water a good remedy for sore throat?, Banking,,,,,,,,
What is Abdul Latif Jameel's contribution towards heavy equipment business? , Advisory Services,,,,,,,,
Where can we source material handling equipments?, Banking,,,,,,,,
How is the heavy industrial equipment market in KSA?, Real Estate,,,,,,,,
I am looking to buy a forklift for my office in Saudi Arabia., Banking,,,,,,,,
How is the residential market catching up in Saudi?, Advisory Services,,,,,,,,
Do you get stable employment in Bahrain?, Banking,,,,,,,,
I have a constant headache and runny nose. Will I be down with a throat infection?, Banking,,,,,,,,
I have swollen glands. Could that be a reason for a sore throat?, Banking,,,,,,,,
I am on the look out for a fool proof way of curing recurrent sore throats., Advisory Services,,,,,,,,
I have just moved houses and my new house is infested with cockroaches. Please help., Banking,,,,,,,,
How to maintain a smooth bikini line?, Banking,,,,,,,,
There are many mosquitoes especially in the area I live in. What can I do?, Banking,,,,,,,,
My mom keeps getting a throat infection. Give me some tips on preventing it?, Advisory Services,,,,,,,,
Someone told me that breathing through the nose helps in avoiding throat infection., Banking,,,,,,,,
Does eating right help in avoiding a throat pain?, Banking,,,,,,,,
I keep getting a sore throat. Is there any precaution I can take?, Loan,,,,,,,,
Is Pif Paf a good brand for insect repellents?, Banking,,,,,,,,
I have often noticed that mosquitoes bite some more than others. Is it true?, Banking,,,,,,,,
Can virtual SSCs help in upgrading the Operational Readiness of your bank?, Banking,,,,,,,,
what are the steps to become an income tax officer through SSC, Banking,,,,,,,,
Financial services provider in India, Loan,,,,,,,,
Cheap payday loans online, Loan,,,,,,,,
Payday Loan, Loan,,,,,,,,
I think I can, I think I can........, Banking,,,,,,,
Savings and Home Loans, Loan,,,,,,,,
why there are no informations on oil price, Banking,,,,,,,,
Are entrepreneurs born or nurtured?, Banking,,,,,,,,
Best ways to invest a good amount of money, Advisory Services,,,,,,,,
Can I fill the application form for Income Tax Officer post being a B.Com graduate?, Advisory Services,,,,,,,,
Present & Future Value Concepts, Advisory Services,,,,,,,,
When do i plan for the dependent returns?, Banking,,,,,,,,
No Spending day??, Banking,,,,,,,,
Please help - what can I afford for my wedding?, Banking,,,,,,,,
Help! How to keep track of expenses, Banking,,,,,,,,
help starting over tracking, Banking,,,,,,,,
Brand new to real world - need help!, Banking,,,,,,,,
If you very bad credit is it possible to get a personal loan?, Loan,,,,,,,,
http://edhec.qualtrics.com/SE/?SID=SV_9yicyCvSVJn0HWZ, Loan,,,,,,,,
http://www.surveymonkey.com/s/PQBN6JV, Advisory Services,,,,,,,,
What is the simplest way to wax bikini line?, Advisory Services,,,,,,,,
Which hair removal cream is good?, Banking,,,,,,,,
Are Veet hair removal cream effective for underarm waxing?, Banking,,,,,,,,
Which industry has the best job in Bahrain?, Banking,,,,,,,,
Where do you get good jobs in Gulf?, Banking,,,,,,,,
What is the best option of hair removal?, Banking,,,,,,,,
Is it safe to use wax strips for facial hair removal?, Banking,,,,,,,,
I want to do bikini wax. Are there any special wax strips for it?, Banking,,,,,,,,
Buy IELTS, IDP TOEFL, GMAT, ESOL, DEGREE, DIPLOMAS, Banking,,,
Do you see much international investments in Bahrain?, Banking,,,,,,,,
Bahrain seems to be a lucrative to work., Advisory Services,,,,,,,,
Are real estate investments profitable in Bahrain?, Real Estate,,,,,,,,
I got a new job in Bahrain. Any suggestions - should I opt?, Banking,,,,,,,,
Which sectors have good opportunities in Bahrain?, Banking,,,,,,,,
How can Bahrain give so much tax holiday?, Banking,,,,,,,,
Is the property market in Bahrain worth investing?, Real Estate,,,,,,,,
Are middle east jobs good and secured?, Loan,,,,,,,,
How is Bahrain economy faring with global economy?, Banking,,,,,,,,
Bahrain good job. Is it easy?, Banking,,,,,,,,
Which countries in the Middle East are good for business?, Loan,,,,,,,,
Introduction, Banking,,,,,,,,
Where can i  find information ?, Banking,,,,,,,,
Inflation-Adjusted Annuity, Banking,,,,,,,,
No Credit History, Need a Car Loan, Loan,,,,,,,
ownership structure, Banking,,,,,,,,
To get an annualized value for 1 month libor do you multiply times 12, Banking,,,,,,,,
a little advice please, Advisory Services,,,,,,,,
Help on problems, Banking,,,,,,,,
The means of online payment for the future, Banking,,,,,,,,
could you please help me with this exercise? please, Banking,,,,,,,,
when i can Filing of Balance She?, Banking,,,,,,,,
GeGeneral Question from a College Freshmen, Banking,,,,,,,,
Low income car affordability?, Loan,,,,,,,,
financial statement help, Advisory Services,,,,,,,,
Trouble Opening a FCDA, Banking,,,,,,,,
Advice on making money, Advisory Services,,,,,,,,
hard finance question, Advisory Services,,,,,,,,
caravan loan, Loan,,,,,,,,
When converting frm an IRA to a Roth, do I have tax?, Banking,,,,,,,
How do I know if I have to file quarterly individual estimated tax payments?, Banking,,,,,,,,
Can I expect good retuns from real estate in Bahrain?, Real Estate,,,,,,,,
Is cost of living high in Bahrain?, Banking,,,,,,,,
Are there luxurious properties in Bahrain?, Banking,,,,,,,,
Does Bahrain have good jobs?, Banking,,,,,,,,
Which is the best industry to work in Bahrain?, Advisory Services,,,,,,,,
How is economy in Bahrain faring?, Banking,,,,,,,,
Is Bahrain a good investment destination?, Banking,,,,,,,,
Is it easy owning properties in Bahrain?, Banking,,,,,,,,
Is Bahrain a good pace to live?, Banking,,,,,,,,
Is Bahrain airport the biggest in Middle East?, Banking,,,,,,,,
How is the work culture in Bahrain?, Advisory Services,,,,,,,,
Which industry verticals can be considered good for investments in Bahrain?, Banking,,,,,,,,
I was evaluating some job offers in Bahrain. Is it a good place to  live and work?, Advisory Services,,,,,,,,
How is real estate and infrastructure in Bahrain?, Real Estate,,,,,,,,
Owning a business in Bahrain. What are the liabilities one needs to be managed?, Loan,,,,,,,,
Is Bahrain a cluster of islands?, Banking,,,,,,,,
I am contemplating buying an Innova. What are the different categories available?, Loan,,,,,,,,
Is Hilux a good pick up van to have?, Banking,,,,,,,,
Is it advisable to buy second hand 4wd vehicle?, Banking,,,,,,,,
I want a compact SUV. Can you recommend a good one?, Banking,,,,,,,,
Advice for loan for mortgage needed badly., Advisory Services,,,,,,,,
Any good free budgeting software out there?, Banking,,,,,,,,
Budget Guidelines and DIY Credit Repair, Credit Card,,,,,,,,
Question about The Crisis of Credit, Credit Card,,,,,,,,
Help determining loan type, Loan,,,,,,,,
looking forward..., Banking,,,,,,,,
Any one Guide Me to Sell My Settlements., Banking,,,,,,,,
How to calculate my personal savings rate?, Loan,,,,,,,,
New here! some questions off the bat, Banking,,,,,,,,
Financial advice on school project, urgent!, Advisory Services,,,,,,,
bust mortgage bank lowered my score. Advice?, Banking,,,,,,,,
Is this smart to do or not?, Banking,,,,,,,,
What Is an Income Annuity?, Banking,,,,,,,,
edupristine, Banking,,,,,,,,
WACC versus APV, Banking,,,,,,,,
My first budget, Banking,,,,,,,,
Pull money from Roth and investments to attend college?, Advisory Services,,,,,,,,
Payoff Advice??, Advisory Services,,,,,,,,
What information is important to you when choosing an IFA?, Banking,,,,,,,,
Standard and Poor, Moody???, Banking,,,,,,,
I want one of the traditional full size SUV. Please suggest?, Banking,,,,,,,,
